news_date,news_headline,outlet_name,audience_reach,uv,tone,medium,outlet_type,custom_tags,news_company_mentions,hash,source_file,latest_date,input_date
2022-09-17,Four West Leeds sites earmarked for local authority housing,West Leeds Dispatch,0,3141.0,POS,Online,"Online, consumer",Local,Leeds 2023,13479499968123036765,Leeds 2023 media coverage 23.09.22-17.10.22.csv,2022-10-17,17/09/2022
2022-09-17,Inspirational Bramley Baths hailed a 'beacon for society' as AGM hears of most successful year,West Leeds Dispatch,0,3141.0,NEU,Online,"Online, consumer",Local,Leeds 2023,453098313913252842,Leeds 2023 media coverage 23.09.22-17.10.22.csv,2022-10-17,17/09/2022
2022-09-17,Support Leeds 2023 city of culture by volunteering,West Leeds Dispatch,0,3141.0,NEU,Online,"Online, consumer",Local,Leeds 2023,10670817045611648545,Leeds 2023 media coverage 23.09.22-17.10.22.csv,2022-10-17,17/09/2022
2022-09-17,Youths shift 34 tonnes as new Bramley eco peace garden takes shape,West Leeds Dispatch,0,3141.0,NEU,Online,"Online, consumer",Local,Leeds 2023,13785126224380383013,Leeds 2023 media coverage 23.09.22-17.10.22.csv,2022-10-17,17/09/2022
2022-09-20,Inspirational Bramley Baths hailed a 'beacon for society' as AGM hears of most successful year,West Leeds Dispatch,0,3141.0,NEU,Online,"Online, consumer",Local,Leeds 2023,12296830178779861036,Leeds 2023 media coverage 23.09.22-17.10.22.csv,2022-10-17,20/09/2022
2022-09-21,Leeds Art Gallery's landmark exhibition puts city's artists in the frame,Leeds City Council News - News,0,0.0,POS,Online,"Online, consumer",Local,Leeds 2023,12907435302582600817,Leeds 2023 media coverage 23.09.22-17.10.22.csv,2022-10-17,21/09/2022
2022-09-22,Art Gallery's landmark exhibition puts city's artists in the frame,South Leeds Life,0,1687.0,POS,Online,"Online, consumer",Local,Leeds 2023,261327467811776476,Leeds 2023 media coverage 23.09.22-17.10.22.csv,2022-10-17,22/09/2022
2022-09-22,Museum Moves 16 - 22 September 2022,Museums + Heritage Advisor,0,5091.0,POS,Online,"Online, consumer",National; Trade,Leeds 2023,7854614377771464393,Leeds 2023 media coverage 23.09.22-17.10.22.csv,2022-10-17,22/09/2022
2022-09-22,Steph's Packed Lunch,Channel 4,2821000,0.0,NEU,Broadcast,Television station,National,,5571260164804428114,Leeds 2023 media coverage 23.09.22-17.10.22.csv,2022-10-17,22/09/2022
2022-09-22,White Rose Shopping Centre Archives,South Leeds Life,0,1687.0,POS,Online,"Online, consumer",Local,Leeds 2023,12672122714843291642,Leeds 2023 media coverage 23.09.22-17.10.22.csv,2022-10-17,22/09/2022
2022-09-23,BBC London News,BBC One Yorkshire,824001,0.0,NEU,Broadcast,Television station,Regional,Leeds 2023; The Awakening,11242621240460740460,Leeds 2023 media coverage 23.09.22-17.10.22.csv,2022-10-17,23/09/2022
2022-09-23,City aims to change lives through art,"Yorkshire Post - North Yorks edition, The",40746,0.0,NEU,Newspaper,Newspaper,Regional,,12530823006848213995,Leeds 2023 media coverage 23.09.22-17.10.22.csv,2022-10-17,23/09/2022
2022-09-23,Creativity is just the ticket,TheTicketingBusiness News,0,0.0,POS,Online,"Online, consumer",International,Leeds Year Of Culture,10310987341733557435,Leeds 2023 media coverage 23.09.22-17.10.22.csv,2022-10-17,23/09/2022
2022-09-23,ITV Lunchtime News,ITV 1 Yorkshire West,790001,0.0,NEU,Broadcast,Television station,Regional,Leeds 2023; The Awakening,5498900192435907297,Leeds 2023 media coverage 23.09.22-17.10.22.csv,2022-10-17,23/09/2022
2022-09-23,ITV Lunchtime News,ITV 1 Yorkshire West,790001,0.0,NEU,Broadcast,Television station,Regional,Leeds 2023; The Awakening,5498900192435907297,Leeds 2023 media coverage 23.09.22-17.10.22.csv,2022-10-17,23/09/2022
2022-09-23,ITV News London,ITV 1 Yorkshire West,790001,0.0,NEU,Broadcast,Television station,Regional,Leeds Year Of Culture; The Awakening,16464507002000761371,Leeds 2023 media coverage 23.09.22-17.10.22.csv,2022-10-17,23/09/2022
2022-09-23,Leeds 2023 announces huge opening show at Headingley Stadium with star-studded lineup,Yorkshire Evening Post - Yorkshireeveningpost.co.uk,0,237450.0,POS,Online,"Online, consumer",Local,Leeds 2023; The Awakening,13111907014656302663,Leeds 2023 media coverage 23.09.22-17.10.22.csv,2022-10-17,23/09/2022
2022-09-23,Leeds 2023 announces initial programme,"Stage - Online, The",0,0.0,NEU,Online,"Online, trade/industry",National; Trade,Leeds 2023,5624794591971906640,Leeds 2023 media coverage 23.09.22-17.10.22.csv,2022-10-17,23/09/2022
2022-09-23,Leeds 2023 opening-ceremony ticket offer tries to harness city's creativity,Breakn,0,0.0,POS,Online,"Online, consumer",International,Leeds 2023,15258909685549879605,Leeds 2023 media coverage 23.09.22-17.10.22.csv,2022-10-17,23/09/2022
2022-09-23,Leeds 2023 opening-ceremony ticket offer tries to harness city's creativity,Finno Expert,0,0.0,POS,Online,"Online, consumer",International,Leeds 2023,3952924213458004859,Leeds 2023 media coverage 23.09.22-17.10.22.csv,2022-10-17,23/09/2022
2022-09-23,Leeds 2023 opening-ceremony ticket offer tries to harness city's creativity,User Walls,0,0.0,POS,Online,"Online, consumer",International,Leeds 2023; The Awakening,11256404434217876465,Leeds 2023 media coverage 23.09.22-17.10.22.csv,2022-10-17,23/09/2022
2022-09-23,Leeds 2023 opening-ceremony ticket offer tries to harness city's creativity,Wopular,0,1987.0,POS,Online,"Online, consumer",International,Leeds 2023,5412564859428766522,Leeds 2023 media coverage 23.09.22-17.10.22.csv,2022-10-17,23/09/2022
2022-09-23,Leeds 2023 opening-ceremony ticket offer tries to harness city's creativity,World News Network,0,197405.0,POS,Online,"Online, consumer",,Leeds 2023,12555577823145920945,Leeds 2023 media coverage 23.09.22-17.10.22.csv,2022-10-17,23/09/2022
2022-09-23,Leeds 2023 opening-ceremony ticket offer tries to harness city's creativity - Entertainment,Anygator (uk),0,171.0,POS,Online,"Online, consumer",,Leeds 2023,886842454211203899,Leeds 2023 media coverage 23.09.22-17.10.22.csv,2022-10-17,23/09/2022
2022-09-23,Leeds 2023 opening-ceremony ticket offer tries to harness city's creativity – BBC,X99news,0,0.0,POS,Online,"Online, consumer",International,Leeds 2023,3951665760751227584,Leeds 2023 media coverage 23.09.22-17.10.22.csv,2022-10-17,23/09/2022
2022-09-23,Leeds 2023 to see a reimagining of Mexico's Day of the Dead as elements of the 'epic' programme revealed,"Yorkshire Post - yorkshirepost.co.uk, The",0,256221.0,NEU,Online,"Online, consumer",Regional,Leeds 2023,3472912622689728753,Leeds 2023 media coverage 23.09.22-17.10.22.csv,2022-10-17,23/09/2022
2022-09-23,NEW EXHIBITION PUTS LEEDS ARTISTS IN THE FRAME - Leeds Guide,Leeds Guide,0,236.0,POS,Online,"Online, consumer",Local,Leeds 2023,5116820852817938261,Leeds 2023 media coverage 23.09.22-17.10.22.csv,2022-10-17,23/09/2022
2022-09-23,Radio clip from BBC Leeds at 2022-09-23 07:20:31.000,BBC Radio Leeds,78000,0.0,POS,Broadcast,Radio station,Regional,Leeds 2023; The Awakening,18010803488318657931,Leeds 2023 media coverage 23.09.22-17.10.22.csv,2022-10-17,23/09/2022
2022-09-23,Radio clip from BBC Leeds at 2022-09-23 07:25:34.000,BBC Radio Leeds,78000,0.0,POS,Broadcast,Radio station,Regional,Leeds 2023,6625728541540036745,Leeds 2023 media coverage 23.09.22-17.10.22.csv,2022-10-17,23/09/2022
2022-09-23,Radio clip from BBC Leeds at 2022-09-23 07:30:01.000,BBC Radio Leeds,78000,0.0,NEU,Broadcast,Radio station,Regional,Leeds 2023,16746403261550445918,Leeds 2023 media coverage 23.09.22-17.10.22.csv,2022-10-17,23/09/2022
2022-09-23,Radio clip from BBC Leeds at 2022-09-23 07:45:05.000,BBC Radio Leeds,78000,0.0,NEU,Broadcast,Radio station,Regional,Leeds 2023,812717281636513069,Leeds 2023 media coverage 23.09.22-17.10.22.csv,2022-10-17,23/09/2022
2022-09-23,Radio clip from BBC Leeds at 2022-09-23 08:00:02.000,BBC Radio Leeds,78000,0.0,NEU,Broadcast,Radio station,Regional,Leeds 2023; The Awakening,3568555552964500590,Leeds 2023 media coverage 23.09.22-17.10.22.csv,2022-10-17,23/09/2022
2022-09-23,Radio clip from BBC Leeds at 2022-09-23 08:37:02.000,BBC Radio Leeds,78000,0.0,POS,Broadcast,Radio station,Regional,Leeds 2023; The Awakening,4143546790762992478,Leeds 2023 media coverage 23.09.22-17.10.22.csv,2022-10-17,23/09/2022
2022-09-23,Radio clip from BBC Leeds at 2022-09-23 08:42:03.000,BBC Radio Leeds,78000,0.0,POS,Broadcast,Radio station,Regional,Leeds 2023; The Awakening,13374294254857567872,Leeds 2023 media coverage 23.09.22-17.10.22.csv,2022-10-17,23/09/2022
2022-09-23,Radio clip from BBC Leeds at 2022-09-23 08:43:30.000,BBC Radio Leeds,78000,0.0,POS,Broadcast,Radio station,Regional,Leeds 2023,12721625480481233298,Leeds 2023 media coverage 23.09.22-17.10.22.csv,2022-10-17,23/09/2022
2022-09-23,Radio clip from BBC Leeds at 2022-09-23 10:04:10.000,BBC Radio Leeds,78000,0.0,POS,Broadcast,Radio station,Regional,Leeds 2023,7215792972350601808,Leeds 2023 media coverage 23.09.22-17.10.22.csv,2022-10-17,23/09/2022
2022-09-23,Radio clip from BBC Leeds at 2022-09-23 10:09:12.000,BBC Radio Leeds,78000,0.0,POS,Broadcast,Radio station,Regional,,4365243095656509822,Leeds 2023 media coverage 23.09.22-17.10.22.csv,2022-10-17,23/09/2022
2022-09-23,Radio clip from BBC Leeds at 2022-09-23 10:31:30.000,BBC Radio Leeds,78000,0.0,POS,Broadcast,Radio station,Regional,,419991456247412632,Leeds 2023 media coverage 23.09.22-17.10.22.csv,2022-10-17,23/09/2022
2022-09-23,Radio clip from BBC Leeds at 2022-09-23 11:00:49.000,BBC Radio Leeds,78000,0.0,NEU,Broadcast,Radio station,Regional,Leeds 2023; The Awakening,3410970902425448597,Leeds 2023 media coverage 23.09.22-17.10.22.csv,2022-10-17,23/09/2022
2022-09-23,Radio clip from BBC Leeds at 2022-09-23 11:16:01.000,BBC Radio Leeds,78000,0.0,POS,Broadcast,Radio station,Regional,The Awakening,1114413308351028261,Leeds 2023 media coverage 23.09.22-17.10.22.csv,2022-10-17,23/09/2022
2022-09-23,Radio clip from BBC Leeds at 2022-09-23 12:00:10.000,BBC Radio Leeds,78000,0.0,NEU,Broadcast,Radio station,Regional,Leeds 2023; The Awakening,8763245917718034249,Leeds 2023 media coverage 23.09.22-17.10.22.csv,2022-10-17,23/09/2022
2022-09-23,Radio clip from BBC Leeds at 2022-09-23 13:00:02.000,BBC Radio Leeds,78000,0.0,NEU,Broadcast,Radio station,Regional,Leeds 2023,9070956421052767506,Leeds 2023 media coverage 23.09.22-17.10.22.csv,2022-10-17,23/09/2022
2022-09-23,Radio clip from BBC Leeds at 2022-09-23 13:49:44.000,BBC Radio Leeds,78000,0.0,NEU,Broadcast,Radio station,Regional,Leeds City of Culture,8173772752246244114,Leeds 2023 media coverage 23.09.22-17.10.22.csv,2022-10-17,23/09/2022
2022-09-23,Radio clip from BBC Leeds at 2022-09-23 14:00:01.000,BBC Radio Leeds,78000,0.0,NEU,Broadcast,Radio station,Regional,Leeds 2023,4403281579496795480,Leeds 2023 media coverage 23.09.22-17.10.22.csv,2022-10-17,23/09/2022
2022-09-23,Radio clip from BBC Leeds at 2022-09-23 14:15:54.000,BBC Radio Leeds,78000,0.0,NEU,Broadcast,Radio station,Regional,Leeds 2023,806227170836069475,Leeds 2023 media coverage 23.09.22-17.10.22.csv,2022-10-17,23/09/2022
2022-09-23,Radio clip from BBC Leeds at 2022-09-23 14:36:18.000,BBC Radio Leeds,78000,0.0,POS,Broadcast,Radio station,Regional,Leeds 2023,15981697211009664108,Leeds 2023 media coverage 23.09.22-17.10.22.csv,2022-10-17,23/09/2022
2022-09-23,Radio clip from BBC Leeds at 2022-09-23 14:41:18.000,BBC Radio Leeds,78000,0.0,POS,Broadcast,Radio station,Regional,Leeds 2023; The Awakening,4792319354748494561,Leeds 2023 media coverage 23.09.22-17.10.22.csv,2022-10-17,23/09/2022
2022-09-23,Radio clip from BBC Leeds at 2022-09-23 15:24:31.000,BBC Radio Leeds,78000,0.0,NEU,Broadcast,Radio station,Regional,Leeds 2023; The Awakening,12724816011203387111,Leeds 2023 media coverage 23.09.22-17.10.22.csv,2022-10-17,23/09/2022
2022-09-23,Radio clip from BBC Leeds at 2022-09-23 15:40:37.000,BBC Radio Leeds,78000,0.0,POS,Broadcast,Radio station,Regional,Leeds 2023,9140519947923954594,Leeds 2023 media coverage 23.09.22-17.10.22.csv,2022-10-17,23/09/2022
2022-09-23,Radio clip from BBC Leeds at 2022-09-23 16:51:42.000,BBC Radio Leeds,78000,0.0,NEU,Broadcast,Radio station,Regional,Leeds 2023; The Awakening,11940192790378544931,Leeds 2023 media coverage 23.09.22-17.10.22.csv,2022-10-17,23/09/2022
2022-09-23,Radio clip from BBC Leeds at 2022-09-23 17:16:24.000,BBC Radio Leeds,78000,0.0,NEU,Broadcast,Radio station,Regional,Leeds 2023,7780125317353822358,Leeds 2023 media coverage 23.09.22-17.10.22.csv,2022-10-17,23/09/2022
2022-09-23,Radio clip from BBC Leeds at 2022-09-23 17:49:55.000,BBC Radio Leeds,78000,0.0,NEU,Broadcast,Radio station,Regional,Leeds 2023,4700351798602794221,Leeds 2023 media coverage 23.09.22-17.10.22.csv,2022-10-17,23/09/2022
2022-09-23,Stadium show offers tickets in exchange for art,MSN News,0,59740000.0,POS,Online,"Online, consumer",International; National,Leeds 2023; The Awakening,5622821259667075576,Leeds 2023 media coverage 23.09.22-17.10.22.csv,2022-10-17,23/09/2022
2022-09-23,Stadium show offers tickets in exchange for art,Vietname Explorer,0,204240.0,POS,Online,"Online, consumer",International,Leeds 2023; The Awakening,7845738271119156569,Leeds 2023 media coverage 23.09.22-17.10.22.csv,2022-10-17,23/09/2022
2022-09-23,Steph's Packed Lunch,Channel 4,2821000,0.0,POS,Broadcast,Television station,National,Leeds 2023; The Awakening,13776639420309993902,Leeds 2023 media coverage 23.09.22-17.10.22.csv,2022-10-17,23/09/2022
2022-09-24,Carly Rae Jepsen to perform 'The So Nice Tour' in Leeds 2023,Yorkshire Evening Post - Yorkshireeveningpost.co.uk,0,237450.0,NEU,Online,"Online, consumer",Local,Leeds 2023,5276860701346253280,Leeds 2023 media coverage 23.09.22-17.10.22.csv,2022-10-17,24/09/2022
2022-09-24,Epic programme announced with 100 days to go to LEEDS 2023,South Leeds Life,0,1687.0,POS,Online,"Online, consumer",Local,Leeds 2023; The Awakening,3563425264857659119,Leeds 2023 media coverage 23.09.22-17.10.22.csv,2022-10-17,24/09/2022
2022-09-24,Headingley Stadium live show announced as 100 day countdown begins,"Yorkshire Post - yorkshirepost.co.uk, The",0,256221.0,NEU,Online,"Online, consumer",Regional,Leeds 2023; The Awakening,12279197122465232687,Leeds 2023 media coverage 23.09.22-17.10.22.csv,2022-10-17,24/09/2022
2022-09-24,How Leeds2023 is transforming the city for its 'Year of Culture',Yorkshire Evening Post - Yorkshireeveningpost.co.uk,0,237450.0,POS,Online,"Online, consumer",Local,Leeds 2023; Leeds Year Of Culture; The Awakening,8216491960072138486,Leeds 2023 media coverage 23.09.22-17.10.22.csv,2022-10-17,24/09/2022
2022-09-24,LEEDS 2023,"British Library, The",0,500.0,POS,Online,"Online, consumer",National; Trade,Leeds 2023,5442639917712973753,Leeds 2023 media coverage 23.09.22-17.10.22.csv,2022-10-17,24/09/2022
2022-09-24,Leeds 2023 announces initial programme,"Stage - thestage.co.uk, The",0,77594.0,POS,Online,"Online, consumer",National; Trade,Leeds 2023,18038727672065273693,Leeds 2023 media coverage 23.09.22-17.10.22.csv,2022-10-17,24/09/2022
2022-09-24,Leeds 2023 opening-ceremony ticket offer tries to harness city's creativity,BBC News Online,0,24207801.0,POS,Online,"Online, consumer",National,Leeds 2023; The Awakening,2967520701425174056,Leeds 2023 media coverage 23.09.22-17.10.22.csv,2022-10-17,24/09/2022
2022-09-24,Leeds 2023 opening-ceremony ticket offer tries to harness city's creativity,CRWE World,0,24972.0,POS,Online,"Online, consumer",International,Leeds 2023,328739526564235389,Leeds 2023 media coverage 23.09.22-17.10.22.csv,2022-10-17,24/09/2022
2022-09-24,Leeds 2023 pening show to kick off at headingley stadium,Yorkshire Evening Post,36512,0.0,NEU,Newspaper,"Newspaper, community",Local,Leeds 2023,3634683216146042512,Leeds 2023 media coverage 23.09.22-17.10.22.csv,2022-10-17,24/09/2022
2022-09-24,Radio clip from BBC Leeds at 2022-09-23 19:06:24.000,BBC Radio Leeds,78000,0.0,POS,Broadcast,Radio station,Regional,,14577489396024857908,Leeds 2023 media coverage 23.09.22-17.10.22.csv,2022-10-17,24/09/2022
2022-09-24,Radio clip from BBC Leeds at 2022-09-23 19:30:00.000,BBC Radio Leeds,78000,0.0,NEU,Broadcast,Radio station,Regional,,8767222356505597021,Leeds 2023 media coverage 23.09.22-17.10.22.csv,2022-10-17,24/09/2022
2022-09-24,Radio clip from BBC Leeds at 2022-09-23 19:35:02.000,BBC Radio Leeds,78000,0.0,POS,Broadcast,Radio station,Regional,Leeds 2023,15723241505154628418,Leeds 2023 media coverage 23.09.22-17.10.22.csv,2022-10-17,24/09/2022
2022-09-24,Radio clip from BBC Leeds at 2022-09-23 19:43:30.000,BBC Radio Leeds,78000,0.0,POS,Broadcast,Radio station,Regional,Leeds 2023,13793176552818839781,Leeds 2023 media coverage 23.09.22-17.10.22.csv,2022-10-17,24/09/2022
2022-09-24,Radio clip from BBC Leeds at 2022-09-23 19:55:48.000,BBC Radio Leeds,78000,0.0,NEU,Broadcast,Radio station,Regional,Leeds 2023,16462475848413410296,Leeds 2023 media coverage 23.09.22-17.10.22.csv,2022-10-17,24/09/2022
2022-09-24,Radio clip from BBC Leeds at 2022-09-23 20:08:31.000,BBC Radio Leeds,78000,0.0,POS,Broadcast,Radio station,Regional,Leeds 2023,495589273487153695,Leeds 2023 media coverage 23.09.22-17.10.22.csv,2022-10-17,24/09/2022
2022-09-24,Radio clip from BBC Leeds at 2022-09-23 20:13:35.000,BBC Radio Leeds,78000,0.0,NEU,Broadcast,Radio station,Regional,Leeds 2023,17620991653567844879,Leeds 2023 media coverage 23.09.22-17.10.22.csv,2022-10-17,24/09/2022
2022-09-24,Radio clip from BBC Leeds at 2022-09-23 20:15:30.000,BBC Radio Leeds,78000,0.0,NEU,Broadcast,Radio station,Regional,Leeds 2023,3747451187248339164,Leeds 2023 media coverage 23.09.22-17.10.22.csv,2022-10-17,24/09/2022
2022-09-24,Radio clip from BBC Leeds at 2022-09-23 20:20:32.000,BBC Radio Leeds,78000,0.0,POS,Broadcast,Radio station,Regional,Leeds 2023,1032511494188145591,Leeds 2023 media coverage 23.09.22-17.10.22.csv,2022-10-17,24/09/2022
2022-09-24,Radio clip from BBC Leeds at 2022-09-23 20:27:56.000,BBC Radio Leeds,78000,0.0,NEU,Broadcast,Radio station,Regional,Leeds 2023; The Awakening,17687563175685069481,Leeds 2023 media coverage 23.09.22-17.10.22.csv,2022-10-17,24/09/2022
2022-09-24,Radio clip from BBC Leeds at 2022-09-23 21:13:37.000,BBC Radio Leeds,78000,0.0,NEU,Broadcast,Radio station,Regional,Leeds 2023; The Awakening,9934202659183965009,Leeds 2023 media coverage 23.09.22-17.10.22.csv,2022-10-17,24/09/2022
2022-09-24,Radio clip from BBC Leeds at 2022-09-23 21:19:30.000,BBC Radio Leeds,78000,0.0,POS,Broadcast,Radio station,Regional,Leeds 2023,14781796940948108585,Leeds 2023 media coverage 23.09.22-17.10.22.csv,2022-10-17,24/09/2022
2022-09-24,Radio clip from BBC Leeds at 2022-09-24 06:04:41.000,BBC Radio Leeds,78000,0.0,NEU,Broadcast,Radio station,Regional,Leeds City of Culture,3030079593963472858,Leeds 2023 media coverage 23.09.22-17.10.22.csv,2022-10-17,24/09/2022
2022-09-24,Radio clip from BBC Leeds at 2022-09-24 06:10:32.000,BBC Radio Leeds,78000,0.0,NEU,Broadcast,Radio station,Regional,Leeds City of Culture,12963700683493553205,Leeds 2023 media coverage 23.09.22-17.10.22.csv,2022-10-17,24/09/2022
2022-09-24,Radio clip from BBC Leeds at 2022-09-24 06:15:31.000,BBC Radio Leeds,78000,0.0,NEU,Broadcast,Radio station,Regional,Leeds 2023; Leeds Year Of Culture,16281897660656533752,Leeds 2023 media coverage 23.09.22-17.10.22.csv,2022-10-17,24/09/2022
2022-09-24,Radio clip from BBC Leeds at 2022-09-24 07:27:56.000,BBC Radio Leeds,78000,0.0,NEU,Broadcast,Radio station,Regional,Leeds Year Of Culture,10006397069189669631,Leeds 2023 media coverage 23.09.22-17.10.22.csv,2022-10-17,24/09/2022
2022-09-24,Radio clip from BBC Leeds at 2022-09-24 07:35:03.000,BBC Radio Leeds,78000,0.0,POS,Broadcast,Radio station,Regional,Leeds 2023,17910013039430115265,Leeds 2023 media coverage 23.09.22-17.10.22.csv,2022-10-17,24/09/2022
2022-09-24,Radio clip from BBC Leeds at 2022-09-24 07:47:51.000,BBC Radio Leeds,78000,0.0,POS,Broadcast,Radio station,Regional,Leeds 2023,7531393181573608400,Leeds 2023 media coverage 23.09.22-17.10.22.csv,2022-10-17,24/09/2022
2022-09-24,Radio clip from BBC Leeds at 2022-09-24 07:51:31.000,BBC Radio Leeds,78000,0.0,POS,Broadcast,Radio station,Regional,Leeds 2023,6259291836684370081,Leeds 2023 media coverage 23.09.22-17.10.22.csv,2022-10-17,24/09/2022
2022-09-24,Radio clip from BBC Leeds at 2022-09-24 07:56:32.000,BBC Radio Leeds,78000,0.0,NEU,Broadcast,Radio station,Regional,Leeds 2023,7462504839259483101,Leeds 2023 media coverage 23.09.22-17.10.22.csv,2022-10-17,24/09/2022
2022-09-24,Radio clip from BBC Leeds at 2022-09-24 09:39:48.000,BBC Radio Leeds,78000,0.0,POS,Broadcast,Radio station,Regional,Leeds 2023,8053300727434941654,Leeds 2023 media coverage 23.09.22-17.10.22.csv,2022-10-17,24/09/2022
2022-09-24,Radio clip from BBC Leeds at 2022-09-24 09:44:49.000,BBC Radio Leeds,78000,0.0,POS,Broadcast,Radio station,Regional,Leeds 2023; Leeds Year Of Culture,17905567910992118207,Leeds 2023 media coverage 23.09.22-17.10.22.csv,2022-10-17,24/09/2022
2022-09-24,Rupaul's Drag Race UK,BBC One Yorkshire,824001,0.0,NEU,Broadcast,Television station,Regional,Leeds 2023; The Awakening,2398723048660413492,Leeds 2023 media coverage 23.09.22-17.10.22.csv,2022-10-17,24/09/2022
2022-09-24,Spectacle of epic art and perfromance is promised for city,"Yorkshire Post - North Yorks edition, The",40746,0.0,POS,Newspaper,Newspaper,Regional,,3803337247225526573,Leeds 2023 media coverage 23.09.22-17.10.22.csv,2022-10-17,24/09/2022
2022-09-24,Stars to launch city's year of culture,Yorkshire Evening Post,36512,0.0,NEU,Newspaper,"Newspaper, community",Local,,4375888342153118125,Leeds 2023 media coverage 23.09.22-17.10.22.csv,2022-10-17,24/09/2022
2022-09-25,Header Carousel Section Archives,South Leeds Life,0,1687.0,NEU,Online,"Online, consumer",Local,Leeds 2023,17179520531291842318,Leeds 2023 media coverage 23.09.22-17.10.22.csv,2022-10-17,25/09/2022
2022-09-25,Radio clip from BBC Humberside at 2022-09-25 17:36:36.000,BBC Radio Humberside,61000,0.0,POS,Broadcast,Radio station,Regional,Leeds 2023,15266679681572413548,Leeds 2023 media coverage 23.09.22-17.10.22.csv,2022-10-17,25/09/2022
2022-09-25,Radio clip from BBC Humberside at 2022-09-25 17:41:37.000,BBC Radio Humberside,61000,0.0,NEU,Broadcast,Radio station,Regional,,3764316597682854216,Leeds 2023 media coverage 23.09.22-17.10.22.csv,2022-10-17,25/09/2022
2022-09-25,Radio clip from BBC Leeds at 2022-09-25 09:48:37.000,BBC Radio Leeds,78000,0.0,NEU,Broadcast,Radio station,Regional,Leeds 2023,10923214204826694897,Leeds 2023 media coverage 23.09.22-17.10.22.csv,2022-10-17,25/09/2022
2022-09-25,Radio clip from BBC Leeds at 2022-09-25 10:30:01.000,BBC Radio Leeds,78000,0.0,NEU,Broadcast,Radio station,Regional,Leeds 2023,4305611333313694178,Leeds 2023 media coverage 23.09.22-17.10.22.csv,2022-10-17,25/09/2022
2022-09-25,Radio clip from BBC Leeds at 2022-09-25 10:37:35.000,BBC Radio Leeds,78000,0.0,POS,Broadcast,Radio station,Regional,Leeds 2023,15014128842196152963,Leeds 2023 media coverage 23.09.22-17.10.22.csv,2022-10-17,25/09/2022
2022-09-25,Radio clip from BBC Leeds at 2022-09-25 10:47:49.000,BBC Radio Leeds,78000,0.0,POS,Broadcast,Radio station,Regional,Leeds 2023,10265375896753336766,Leeds 2023 media coverage 23.09.22-17.10.22.csv,2022-10-17,25/09/2022
2022-09-25,Radio clip from BBC Leeds at 2022-09-25 17:35:34.000,BBC Radio Leeds,78000,0.0,POS,Broadcast,Radio station,Regional,Leeds 2023,4965054960974007868,Leeds 2023 media coverage 23.09.22-17.10.22.csv,2022-10-17,25/09/2022
2022-09-25,Radio clip from BBC Leeds at 2022-09-25 17:39:37.000,BBC Radio Leeds,78000,0.0,POS,Broadcast,Radio station,Regional,Leeds 2023,3643486244049310426,Leeds 2023 media coverage 23.09.22-17.10.22.csv,2022-10-17,25/09/2022
2022-09-25,Radio clip from BBC Leeds at 2022-09-25 18:57:16.000,BBC Radio Leeds,78000,0.0,NEU,Broadcast,Radio station,Regional,Leeds 2023,9520553695537790239,Leeds 2023 media coverage 23.09.22-17.10.22.csv,2022-10-17,25/09/2022
2022-09-25,Radio clip from BBC Sheffield at 2022-09-25 17:37:12.000,BBC Radio Sheffield,75000,0.0,POS,Broadcast,Radio station,Regional,Leeds 2023,6518897991039796677,Leeds 2023 media coverage 23.09.22-17.10.22.csv,2022-10-17,25/09/2022
2022-09-25,Radio clip from BBC Sheffield at 2022-09-25 17:42:14.000,BBC Radio Sheffield,75000,0.0,POS,Broadcast,Radio station,Regional,,11852655494558344656,Leeds 2023 media coverage 23.09.22-17.10.22.csv,2022-10-17,25/09/2022
2022-09-25,Radio clip from BBC Sheffield at 2022-09-25 18:57:02.000,BBC Radio Sheffield,75000,0.0,POS,Broadcast,Radio station,Regional,Leeds 2023,17095988276218048910,Leeds 2023 media coverage 23.09.22-17.10.22.csv,2022-10-17,25/09/2022
2022-09-25,Radio clip from BBC York at 2022-09-25 17:27:27.000,BBC Radio York,28000,0.0,POS,Broadcast,Radio station,Regional,Leeds 2023,14537962913325100842,Leeds 2023 media coverage 23.09.22-17.10.22.csv,2022-10-17,25/09/2022
2022-09-25,Radio clip from BBC York at 2022-09-25 17:30:03.000,BBC Radio York,28000,0.0,POS,Broadcast,Radio station,Regional,Leeds 2023,7439830915298015318,Leeds 2023 media coverage 23.09.22-17.10.22.csv,2022-10-17,25/09/2022
2022-09-26,BBC London News,BBC One Yorkshire,824001,0.0,NEU,Broadcast,Television station,Regional,Leeds City of Culture; The Awakening,13241215717278871248,Leeds 2023 media coverage 23.09.22-17.10.22.csv,2022-10-17,26/09/2022
2022-09-26,BBC News,BBC News Channel,505000,0.0,POS,Broadcast,Television station,National; Regional,Leeds 2023,9089332984503131778,Leeds 2023 media coverage 23.09.22-17.10.22.csv,2022-10-17,26/09/2022
2022-09-26,BBC News,BBC Two,2638000,0.0,POS,Broadcast,Television station,,Leeds 2023,3548856497351009522,Leeds 2023 media coverage 23.09.22-17.10.22.csv,2022-10-17,26/09/2022
2022-09-26,BBC News,BBC Two Wales,572001,0.0,NEU,Broadcast,Television station,National,Leeds 2023,10964937500665575667,Leeds 2023 media coverage 23.09.22-17.10.22.csv,2022-10-17,26/09/2022
2022-09-26,BBC News at One,BBC 1 Oxford,229000,0.0,NEU,Broadcast,Television station,Regional,Leeds 2023,18238994333070905901,Leeds 2023 media coverage 23.09.22-17.10.22.csv,2022-10-17,26/09/2022
2022-09-26,BBC News at One,BBC Cymru Wales,1145001,0.0,NEU,Broadcast,Television station,,Leeds 2023,2780476419359269569,Leeds 2023 media coverage 23.09.22-17.10.22.csv,2022-10-17,26/09/2022
2022-09-26,BBC News at One,BBC London,5001000,0.0,NEU,Broadcast,Television station,Regional,Leeds 2023,7309946039832003573,Leeds 2023 media coverage 23.09.22-17.10.22.csv,2022-10-17,26/09/2022
2022-09-26,BBC News at One,BBC London,0,0.0,NEU,Broadcast,Television station,Regional,Leeds 2023,12553542126462527081,Leeds 2023 media coverage 23.09.22-17.10.22.csv,2022-10-17,26/09/2022
2022-09-26,BBC News at One,BBC News Channel,505000,0.0,NEU,Broadcast,Television station,National; Regional,Leeds 2023,7845955624415713679,Leeds 2023 media coverage 23.09.22-17.10.22.csv,2022-10-17,26/09/2022
2022-09-26,BBC News at One,BBC Northern Ireland,687000,0.0,NEU,Broadcast,Television station,,Leeds 2023,7547099086192238303,Leeds 2023 media coverage 23.09.22-17.10.22.csv,2022-10-17,26/09/2022
2022-09-26,BBC News at One,BBC One Channel Islands,0,0.0,NEU,Broadcast,Television station,Regional,Leeds 2023,4638187334278034728,Leeds 2023 media coverage 23.09.22-17.10.22.csv,2022-10-17,26/09/2022
2022-09-26,BBC News at One,BBC One East,412000,0.0,NEU,Broadcast,Television station,Regional,Leeds 2023,18139487263580618165,Leeds 2023 media coverage 23.09.22-17.10.22.csv,2022-10-17,26/09/2022
2022-09-26,BBC News at One,BBC One East Midlands,687000,0.0,NEU,Broadcast,Television station,Regional,Leeds 2023,11195111546449897063,Leeds 2023 media coverage 23.09.22-17.10.22.csv,2022-10-17,26/09/2022
2022-09-26,BBC News at One,BBC One North East & Cumbria,802000,0.0,NEU,Broadcast,Television station,Regional,Leeds 2023,13094401651788292501,Leeds 2023 media coverage 23.09.22-17.10.22.csv,2022-10-17,26/09/2022
2022-09-26,BBC News at One,BBC One North West,916001,0.0,NEU,Broadcast,Television station,Regional,Leeds 2023,17331570690028523838,Leeds 2023 media coverage 23.09.22-17.10.22.csv,2022-10-17,26/09/2022
2022-09-26,BBC News at One,BBC One South,687000,0.0,NEU,Broadcast,Television station,Regional,Leeds 2023,6704579474291390329,Leeds 2023 media coverage 23.09.22-17.10.22.csv,2022-10-17,26/09/2022
2022-09-26,BBC News at One,BBC One South East,916001,0.0,NEU,Broadcast,Television station,Regional,Leeds 2023,18403189242400011310,Leeds 2023 media coverage 23.09.22-17.10.22.csv,2022-10-17,26/09/2022
2022-09-26,BBC News at One,BBC One South West,458000,0.0,NEU,Broadcast,Television station,Regional,Leeds 2023,13918876959854037359,Leeds 2023 media coverage 23.09.22-17.10.22.csv,2022-10-17,26/09/2022
2022-09-26,BBC News at One,BBC One West,687000,0.0,NEU,Broadcast,Television station,Regional,Leeds 2023,9864468387998633567,Leeds 2023 media coverage 23.09.22-17.10.22.csv,2022-10-17,26/09/2022
2022-09-26,BBC News at One,BBC One Yorks & Lincs,870001,0.0,NEU,Broadcast,Television station,Regional,Leeds 2023,9153587458179741637,Leeds 2023 media coverage 23.09.22-17.10.22.csv,2022-10-17,26/09/2022
2022-09-26,BBC News at One,BBC One Yorkshire,824001,0.0,NEU,Broadcast,Television station,Regional,Leeds 2023,17673189182243735186,Leeds 2023 media coverage 23.09.22-17.10.22.csv,2022-10-17,26/09/2022
2022-09-26,BBC News at One,BBC Scotland,1833000,0.0,NEU,Broadcast,Television station,National,Leeds 2023,9152874819603997676,Leeds 2023 media coverage 23.09.22-17.10.22.csv,2022-10-17,26/09/2022
2022-09-26,BBC News at One,BBC West Midlands,458000,0.0,NEU,Broadcast,Television station,Regional,Leeds 2023,15672028112708270751,Leeds 2023 media coverage 23.09.22-17.10.22.csv,2022-10-17,26/09/2022
2022-09-26,BBC News at One,BBC1 Cambridge,0,0.0,NEU,Broadcast,Television station,Regional,Leeds 2023,17315628870633829537,Leeds 2023 media coverage 23.09.22-17.10.22.csv,2022-10-17,26/09/2022
2022-09-26,Breakfast,BBC 1 Oxford,229000,0.0,POS,Broadcast,Television station,Regional,Leeds 2023,15335973876140260944,Leeds 2023 media coverage 23.09.22-17.10.22.csv,2022-10-17,26/09/2022
2022-09-26,Breakfast,BBC 1 Oxford,229000,0.0,POS,Broadcast,Television station,Regional,Leeds 2023,18241929832043107931,Leeds 2023 media coverage 23.09.22-17.10.22.csv,2022-10-17,26/09/2022
2022-09-26,Breakfast,BBC Cymru Wales,1145001,0.0,NEU,Broadcast,Television station,,Leeds 2023,13530748523500351924,Leeds 2023 media coverage 23.09.22-17.10.22.csv,2022-10-17,26/09/2022
2022-09-26,Breakfast,BBC Cymru Wales,1145001,0.0,POS,Broadcast,Television station,,Leeds 2023,17488245164107415095,Leeds 2023 media coverage 23.09.22-17.10.22.csv,2022-10-17,26/09/2022
2022-09-26,Breakfast,BBC London,0,0.0,POS,Broadcast,Television station,Regional,Leeds 2023,6552030297184296388,Leeds 2023 media coverage 23.09.22-17.10.22.csv,2022-10-17,26/09/2022
2022-09-26,Breakfast,BBC London,5001000,0.0,POS,Broadcast,Television station,Regional,Leeds 2023,12005104063822718840,Leeds 2023 media coverage 23.09.22-17.10.22.csv,2022-10-17,26/09/2022
2022-09-26,Breakfast,BBC London,0,0.0,POS,Broadcast,Television station,Regional,Leeds 2023,8643249713331946447,Leeds 2023 media coverage 23.09.22-17.10.22.csv,2022-10-17,26/09/2022
2022-09-26,Breakfast,BBC London,5001000,0.0,POS,Broadcast,Television station,Regional,Leeds 2023,2031779136456763027,Leeds 2023 media coverage 23.09.22-17.10.22.csv,2022-10-17,26/09/2022
2022-09-26,Breakfast,BBC News Channel,505000,0.0,POS,Broadcast,Television station,National; Regional,Leeds 2023,3035864430352820857,Leeds 2023 media coverage 23.09.22-17.10.22.csv,2022-10-17,26/09/2022
2022-09-26,Breakfast,BBC News Channel,505000,0.0,POS,Broadcast,Television station,National; Regional,Leeds 2023,431758840572680085,Leeds 2023 media coverage 23.09.22-17.10.22.csv,2022-10-17,26/09/2022
2022-09-26,Breakfast,BBC Northern Ireland,687000,0.0,NEU,Broadcast,Television station,,Leeds 2023,2295416105595754608,Leeds 2023 media coverage 23.09.22-17.10.22.csv,2022-10-17,26/09/2022
2022-09-26,Breakfast,BBC Northern Ireland,687000,0.0,POS,Broadcast,Television station,,Leeds 2023,2066716142597671698,Leeds 2023 media coverage 23.09.22-17.10.22.csv,2022-10-17,26/09/2022
2022-09-26,Breakfast,BBC One Channel Islands,0,0.0,NEU,Broadcast,Television station,Regional,Leeds 2023,16652963830869263710,Leeds 2023 media coverage 23.09.22-17.10.22.csv,2022-10-17,26/09/2022
2022-09-26,Breakfast,BBC One Channel Islands,0,0.0,NEU,Broadcast,Television station,Regional,Leeds 2023,3639593339238003324,Leeds 2023 media coverage 23.09.22-17.10.22.csv,2022-10-17,26/09/2022
2022-09-26,Breakfast,BBC One East,412000,0.0,NEU,Broadcast,Television station,Regional,Leeds 2023,4280185108939260147,Leeds 2023 media coverage 23.09.22-17.10.22.csv,2022-10-17,26/09/2022
2022-09-26,Breakfast,BBC One East,412000,0.0,POS,Broadcast,Television station,Regional,Leeds 2023,13346414306200895448,Leeds 2023 media coverage 23.09.22-17.10.22.csv,2022-10-17,26/09/2022
2022-09-26,Breakfast,BBC One East Midlands,687000,0.0,NEU,Broadcast,Television station,Regional,Leeds 2023,6465161075681285034,Leeds 2023 media coverage 23.09.22-17.10.22.csv,2022-10-17,26/09/2022
2022-09-26,Breakfast,BBC One East Midlands,687000,0.0,POS,Broadcast,Television station,Regional,Leeds 2023,8944670027646013514,Leeds 2023 media coverage 23.09.22-17.10.22.csv,2022-10-17,26/09/2022
2022-09-26,Breakfast,BBC One North East & Cumbria,802000,0.0,POS,Broadcast,Television station,Regional,Leeds 2023,2697256975982563042,Leeds 2023 media coverage 23.09.22-17.10.22.csv,2022-10-17,26/09/2022
2022-09-26,Breakfast,BBC One North East & Cumbria,802000,0.0,POS,Broadcast,Television station,Regional,Leeds 2023,2295339192179306227,Leeds 2023 media coverage 23.09.22-17.10.22.csv,2022-10-17,26/09/2022
2022-09-26,Breakfast,BBC One North West,916001,0.0,NEU,Broadcast,Television station,Regional,Leeds 2023,10776971542444638368,Leeds 2023 media coverage 23.09.22-17.10.22.csv,2022-10-17,26/09/2022
2022-09-26,Breakfast,BBC One North West,916001,0.0,POS,Broadcast,Television station,Regional,Leeds 2023,9352693027433204759,Leeds 2023 media coverage 23.09.22-17.10.22.csv,2022-10-17,26/09/2022
2022-09-26,Breakfast,BBC One South,687000,0.0,NEU,Broadcast,Television station,Regional,Leeds 2023,8591154524770671328,Leeds 2023 media coverage 23.09.22-17.10.22.csv,2022-10-17,26/09/2022
2022-09-26,Breakfast,BBC One South,687000,0.0,POS,Broadcast,Television station,Regional,Leeds 2023,2080757145526669728,Leeds 2023 media coverage 23.09.22-17.10.22.csv,2022-10-17,26/09/2022
2022-09-26,Breakfast,BBC One South East,916001,0.0,NEU,Broadcast,Television station,Regional,Leeds 2023,1031095243354181319,Leeds 2023 media coverage 23.09.22-17.10.22.csv,2022-10-17,26/09/2022
2022-09-26,Breakfast,BBC One South East,916001,0.0,POS,Broadcast,Television station,Regional,Leeds 2023,15055942246316334663,Leeds 2023 media coverage 23.09.22-17.10.22.csv,2022-10-17,26/09/2022
2022-09-26,Breakfast,BBC One South West,458000,0.0,POS,Broadcast,Television station,Regional,Leeds 2023,13698076926467126094,Leeds 2023 media coverage 23.09.22-17.10.22.csv,2022-10-17,26/09/2022
2022-09-26,Breakfast,BBC One South West,458000,0.0,POS,Broadcast,Television station,Regional,Leeds 2023,3064897179616829433,Leeds 2023 media coverage 23.09.22-17.10.22.csv,2022-10-17,26/09/2022
2022-09-26,Breakfast,BBC One West,687000,0.0,POS,Broadcast,Television station,Regional,Leeds 2023,6537591052085191294,Leeds 2023 media coverage 23.09.22-17.10.22.csv,2022-10-17,26/09/2022
2022-09-26,Breakfast,BBC One West,687000,0.0,POS,Broadcast,Television station,Regional,Leeds 2023,11324795246580788681,Leeds 2023 media coverage 23.09.22-17.10.22.csv,2022-10-17,26/09/2022
2022-09-26,Breakfast,BBC One Yorks & Lincs,870001,0.0,NEU,Broadcast,Television station,Regional,Leeds City of Culture; The Awakening,4728874971587094860,Leeds 2023 media coverage 23.09.22-17.10.22.csv,2022-10-17,26/09/2022
2022-09-26,Breakfast,BBC One Yorks & Lincs,870001,0.0,NEU,Broadcast,Television station,Regional,Leeds 2023,18437872128890420451,Leeds 2023 media coverage 23.09.22-17.10.22.csv,2022-10-17,26/09/2022
2022-09-26,Breakfast,BBC One Yorks & Lincs,870001,0.0,NEU,Broadcast,Television station,Regional,Leeds City of Culture; The Awakening,908328126181137976,Leeds 2023 media coverage 23.09.22-17.10.22.csv,2022-10-17,26/09/2022
2022-09-26,Breakfast,BBC One Yorks & Lincs,870001,0.0,POS,Broadcast,Television station,Regional,Leeds 2023,4555483715534949556,Leeds 2023 media coverage 23.09.22-17.10.22.csv,2022-10-17,26/09/2022
2022-09-26,Breakfast,BBC One Yorks & Lincs,870001,0.0,NEU,Broadcast,Television station,Regional,Leeds City of Culture; The Awakening,4617359926516393027,Leeds 2023 media coverage 23.09.22-17.10.22.csv,2022-10-17,26/09/2022
2022-09-26,Breakfast,BBC One Yorkshire,824001,0.0,NEU,Broadcast,Television station,Regional,Leeds City of Culture; The Awakening,18103053499181639787,Leeds 2023 media coverage 23.09.22-17.10.22.csv,2022-10-17,26/09/2022
2022-09-26,Breakfast,BBC One Yorkshire,824001,0.0,POS,Broadcast,Television station,Regional,Leeds 2023,5599371944340640799,Leeds 2023 media coverage 23.09.22-17.10.22.csv,2022-10-17,26/09/2022
2022-09-26,Breakfast,BBC One Yorkshire,824001,0.0,NEU,Broadcast,Television station,Regional,Leeds City of Culture; The Awakening,16360403226607063865,Leeds 2023 media coverage 23.09.22-17.10.22.csv,2022-10-17,26/09/2022
2022-09-26,Breakfast,BBC One Yorkshire,824001,0.0,POS,Broadcast,Television station,Regional,Leeds 2023,10163444560039244276,Leeds 2023 media coverage 23.09.22-17.10.22.csv,2022-10-17,26/09/2022
2022-09-26,Breakfast,BBC One Yorkshire,824001,0.0,NEU,Broadcast,Television station,Regional,Leeds City of Culture,4056808556770265840,Leeds 2023 media coverage 23.09.22-17.10.22.csv,2022-10-17,26/09/2022
2022-09-26,Breakfast,BBC Scotland,1833000,0.0,POS,Broadcast,Television station,National,Leeds 2023,4459358278862742242,Leeds 2023 media coverage 23.09.22-17.10.22.csv,2022-10-17,26/09/2022
2022-09-26,Breakfast,BBC Scotland,1833000,0.0,POS,Broadcast,Television station,National,Leeds 2023,9659030543243304339,Leeds 2023 media coverage 23.09.22-17.10.22.csv,2022-10-17,26/09/2022
2022-09-26,Breakfast,BBC West Midlands,458000,0.0,POS,Broadcast,Television station,Regional,Leeds 2023,3244134851127810772,Leeds 2023 media coverage 23.09.22-17.10.22.csv,2022-10-17,26/09/2022
2022-09-26,Breakfast,BBC West Midlands,458000,0.0,POS,Broadcast,Television station,Regional,Leeds 2023,17188320905705917833,Leeds 2023 media coverage 23.09.22-17.10.22.csv,2022-10-17,26/09/2022
2022-09-26,Breakfast,BBC1 Cambridge,0,0.0,POS,Broadcast,Television station,Regional,Leeds 2023,3436671245535579548,Leeds 2023 media coverage 23.09.22-17.10.22.csv,2022-10-17,26/09/2022
2022-09-26,Breakfast,BBC1 Cambridge,0,0.0,POS,Broadcast,Television station,Regional,Leeds 2023,8479403904714237335,Leeds 2023 media coverage 23.09.22-17.10.22.csv,2022-10-17,26/09/2022
2022-09-26,Details revealed on Leeds 2023 programme,Insider Media,0,91697.0,POS,Online,"Online, trade/industry",Regional,Leeds 2023; The Awakening,17370385627348249229,Leeds 2023 media coverage 23.09.22-17.10.22.csv,2022-10-17,26/09/2022
2022-09-26,Newsletter,Insider Daily (Yorkshire) Newsletter,0,0.0,NEU,Newspaper,Newspaper,Regional,Leeds 2023,2543327934658386706,Leeds 2023 media coverage 23.09.22-17.10.22.csv,2022-10-17,26/09/2022
2022-09-26,Radio clip from BBC Leeds at 2022-09-25 19:06:59.000,BBC Radio Leeds,78000,0.0,POS,Broadcast,Radio station,Regional,Leeds 2023,16287103614225109467,Leeds 2023 media coverage 23.09.22-17.10.22.csv,2022-10-17,26/09/2022
2022-09-26,Radio clip from BBC Leeds at 2022-09-25 19:17:03.000,BBC Radio Leeds,78000,0.0,POS,Broadcast,Radio station,Regional,Leeds 2023,12921534425124235190,Leeds 2023 media coverage 23.09.22-17.10.22.csv,2022-10-17,26/09/2022
2022-09-26,Radio clip from BBC Leeds at 2022-09-25 19:22:06.000,BBC Radio Leeds,78000,0.0,POS,Broadcast,Radio station,Regional,Leeds 2023,1004366579939866100,Leeds 2023 media coverage 23.09.22-17.10.22.csv,2022-10-17,26/09/2022
2022-09-26,Radio clip from BBC Leeds at 2022-09-26 07:24:47.000,BBC Radio Leeds,78000,0.0,POS,Broadcast,Radio station,Regional,Leeds 2023,2299106467641552009,Leeds 2023 media coverage 23.09.22-17.10.22.csv,2022-10-17,26/09/2022
2022-09-26,Radio clip from BBC Leeds at 2022-09-26 09:40:40.000,BBC Radio Leeds,78000,0.0,NEU,Broadcast,Radio station,Regional,Leeds 2023,5134648854901425245,Leeds 2023 media coverage 23.09.22-17.10.22.csv,2022-10-17,26/09/2022
2022-09-26,Radio clip from BBC Leeds at 2022-09-26 10:07:41.000,BBC Radio Leeds,78000,0.0,NEU,Broadcast,Radio station,Regional,Leeds City of Culture,12702405785703135925,Leeds 2023 media coverage 23.09.22-17.10.22.csv,2022-10-17,26/09/2022
2022-09-26,Radio clip from BBC Leeds at 2022-09-26 11:36:12.000,BBC Radio Leeds,78000,0.0,NEU,Broadcast,Radio station,Regional,Leeds City of Culture; The Awakening,4775896872694681897,Leeds 2023 media coverage 23.09.22-17.10.22.csv,2022-10-17,26/09/2022
2022-09-26,Radio clip from BBC Leeds at 2022-09-26 12:18:44.000,BBC Radio Leeds,78000,0.0,POS,Broadcast,Radio station,Regional,Leeds 2023,13751541941203617254,Leeds 2023 media coverage 23.09.22-17.10.22.csv,2022-10-17,26/09/2022
2022-09-26,Radio clip from BBC Leeds at 2022-09-26 12:29:19.000,BBC Radio Leeds,78000,0.0,NEU,Broadcast,Radio station,Regional,,17060713160556162619,Leeds 2023 media coverage 23.09.22-17.10.22.csv,2022-10-17,26/09/2022
2022-09-26,Radio clip from BBC Leeds at 2022-09-26 12:44:29.000,BBC Radio Leeds,78000,0.0,NEU,Broadcast,Radio station,Regional,Leeds City of Culture,14870035659473703323,Leeds 2023 media coverage 23.09.22-17.10.22.csv,2022-10-17,26/09/2022
2022-09-26,Radio clip from BBC Leeds at 2022-09-26 12:50:28.000,BBC Radio Leeds,78000,0.0,POS,Broadcast,Radio station,Regional,Leeds 2023,4379954211011341902,Leeds 2023 media coverage 23.09.22-17.10.22.csv,2022-10-17,26/09/2022
2022-09-26,Radio clip from BBC Leeds at 2022-09-26 16:19:11.000,BBC Radio Leeds,78000,0.0,NEU,Broadcast,Radio station,Regional,Leeds 2023,10053569337607623220,Leeds 2023 media coverage 23.09.22-17.10.22.csv,2022-10-17,26/09/2022
2022-09-26,Radio clip from BBC Sheffield at 2022-09-25 19:02:30.000,BBC Radio Sheffield,75000,0.0,NEU,Broadcast,Radio station,Regional,Leeds 2023,7750659299912856301,Leeds 2023 media coverage 23.09.22-17.10.22.csv,2022-10-17,26/09/2022
2022-09-26,Radio clip from BBC Sheffield at 2022-09-25 19:17:36.000,BBC Radio Sheffield,75000,0.0,POS,Broadcast,Radio station,Regional,Leeds 2023,1175273907727147757,Leeds 2023 media coverage 23.09.22-17.10.22.csv,2022-10-17,26/09/2022
2022-09-27,Eurovision 2023: Update expected on host shortlist,BBC News Online,0,24207801.0,POS,Online,"Online, consumer",National,,15193006030220749773,Leeds 2023 media coverage 23.09.22-17.10.22.csv,2022-10-17,27/09/2022
2022-09-27,LEEDS 2023 opening show- enter the ticket ballot!,Doinggoodleeds.org,0,0.0,POS,Online,"Online, consumer",,Leeds 2023; The Awakening,7752806772650727296,Leeds 2023 media coverage 23.09.22-17.10.22.csv,2022-10-17,27/09/2022
2022-09-27,Leeds is officially out of the running for Eurovision Song Contest 2023,"Hoot, The",0,5000.0,POS,Online,"Online, consumer",National,,3246772138745795798,Leeds 2023 media coverage 23.09.22-17.10.22.csv,2022-10-17,27/09/2022
2022-09-27,Leeds ruled out of race to host Eurovision 2023 as two cities shortlisted,Yorkshire Evening Post - Yorkshireeveningpost.co.uk,0,237450.0,POS,Online,"Online, consumer",Local,Leeds 2023,3944990390284953931,Leeds 2023 media coverage 23.09.22-17.10.22.csv,2022-10-17,27/09/2022
2022-09-27,Radio clip from BBC Jersey at 2022-09-27 09:19:19.000,BBC Radio Jersey,10000,0.0,POS,Broadcast,Radio station,Regional,Leeds 2023,17602612341193234055,Leeds 2023 media coverage 23.09.22-17.10.22.csv,2022-10-17,27/09/2022
2022-09-27,Radio clip from BBC Jersey at 2022-09-27 10:30:16.000,BBC Radio Jersey,10000,0.0,POS,Broadcast,Radio station,Regional,Leeds 2023,4379614549401148857,Leeds 2023 media coverage 23.09.22-17.10.22.csv,2022-10-17,27/09/2022
2022-09-27,Radio clip from BBC Leeds at 2022-09-26 19:05:43.000,BBC Radio Leeds,78000,0.0,POS,Broadcast,Radio station,Regional,,9377562735438289084,Leeds 2023 media coverage 23.09.22-17.10.22.csv,2022-10-17,27/09/2022
2022-09-27,Radio clip from BBC Leeds at 2022-09-26 19:41:41.000,BBC Radio Leeds,78000,0.0,POS,Broadcast,Radio station,Regional,Leeds 2023,8186964707191613996,Leeds 2023 media coverage 23.09.22-17.10.22.csv,2022-10-17,27/09/2022
2022-09-27,Radio clip from BBC Leeds at 2022-09-27 07:08:38.000,BBC Radio Leeds,78000,0.0,NEU,Broadcast,Radio station,Regional,Leeds 2023,14843989849828832065,Leeds 2023 media coverage 23.09.22-17.10.22.csv,2022-10-17,27/09/2022
2022-09-27,Radio clip from BBC Leeds at 2022-09-27 07:51:38.000,BBC Radio Leeds,78000,0.0,POS,Broadcast,Radio station,Regional,Leeds 2023,265753214422161241,Leeds 2023 media coverage 23.09.22-17.10.22.csv,2022-10-17,27/09/2022
2022-09-27,Radio clip from BBC Leeds at 2022-09-27 09:53:14.000,BBC Radio Leeds,78000,0.0,NEU,Broadcast,Radio station,Regional,Leeds 2023,6695763501403212914,Leeds 2023 media coverage 23.09.22-17.10.22.csv,2022-10-17,27/09/2022
2022-09-27,Update expected on host shortlist,BBC News Online,0,24207801.0,POS,Online,"Online, consumer",National,,1557513155262644491,Leeds 2023 media coverage 23.09.22-17.10.22.csv,2022-10-17,27/09/2022
2022-09-27,White Rose Shopping Centre Archives,South Leeds Life,0,1687.0,POS,Online,"Online, consumer",Local,Leeds 2023,13661315599665131692,Leeds 2023 media coverage 23.09.22-17.10.22.csv,2022-10-17,27/09/2022
2022-09-28,Eurovision bid fails for Leeds,Yorkshire Evening Post,36512,0.0,POS,Newspaper,"Newspaper, community",Local,Leeds 2023,7736687806648830360,Leeds 2023 media coverage 23.09.22-17.10.22.csv,2022-10-17,28/09/2022
2022-09-28,Leeds 2023 programme revealed,ArtsProfessional,0,13218.0,POS,Online,"Online, consumer",National,Leeds 2023; The Awakening,4071329141983650567,Leeds 2023 media coverage 23.09.22-17.10.22.csv,2022-10-17,28/09/2022
2022-09-28,eNews 28 September,Forstaff main index,0,0.0,POS,Online,"Online, consumer",Local,Leeds 2023,6009393605818414891,Leeds 2023 media coverage 23.09.22-17.10.22.csv,2022-10-17,28/09/2022
2022-09-29,24 Big Changes in the Pipeline for Leeds,Leeds-List.com,0,27124.0,POS,Online,"Online, consumer",Local,Leeds 2023,3483524286247663020,Leeds 2023 media coverage 23.09.22-17.10.22.csv,2022-10-17,29/09/2022
2022-09-29,Gabby Logan's favourite Yorkshire view,hertfordshire.greatbritishlife.co.uk,0,500.0,POS,Online,"Online, consumer",Regional,Leeds 2023,3357961273113342142,Leeds 2023 media coverage 23.09.22-17.10.22.csv,2022-10-17,29/09/2022
2022-09-29,Get creative to win tickets to The Awakening,Yorkshire Evening Post - Yorkshireeveningpost.co.uk,0,237450.0,POS,Online,"Online, consumer",Local,Leeds 2023; The Awakening,11759394903342916013,Leeds 2023 media coverage 23.09.22-17.10.22.csv,2022-10-17,29/09/2022
2022-09-29,Get creative to win tickets to The Awakening,"Yorkshire Post - yorkshirepost.co.uk, The",0,256221.0,POS,Online,"Online, consumer",Regional,Leeds 2023; The Awakening,16948472522786510409,Leeds 2023 media coverage 23.09.22-17.10.22.csv,2022-10-17,29/09/2022
2022-10-01,Leeds Art Gallery's Landmark Exhibition,Yorkshire Reporter Online,0,939.0,POS,Online,"Online, consumer",Regional,Leeds 2023,15401416200254121096,Leeds 2023 media coverage 23.09.22-17.10.22.csv,2022-10-17,01/10/2022
2022-10-01,Leeds Art Gallery’s landmark exhibition puts city’s artists in the frame,Asian Voice,18000,0.0,POS,Newspaper,"Newspaper, community",,Leeds 2023,14314533519972439338,Leeds 2023 media coverage 23.09.22-17.10.22.csv,2022-10-17,01/10/2022
2022-10-02,Gabby Logan's favourite Yorkshire view,Devon Life (Online),0,11673.0,POS,Online,"Online, consumer",Regional,Leeds 2023,17605683752944548622,Leeds 2023 media coverage 23.09.22-17.10.22.csv,2022-10-17,02/10/2022
2022-10-02,Rugby League World Cup: Cultural Festival volunteer performers wanted,ManchesterWorld,0,106069.0,POS,Online,"Online, consumer",Regional,Leeds 2023,155309580598710727,Leeds 2023 media coverage 23.09.22-17.10.22.csv,2022-10-17,02/10/2022
2022-10-02,Rugby League World Cup: Cultural Festival volunteer performers wanted,Newcastle World,0,0.0,POS,Online,"Online, consumer",Regional,Leeds 2023,6668007045069860034,Leeds 2023 media coverage 23.09.22-17.10.22.csv,2022-10-17,02/10/2022
2022-10-02,Rugby League World Cup: Cultural Festival volunteer performers wanted,Sheffield Star,0,134423.0,POS,Online,"Online, consumer",Regional,Leeds 2023,16246485628603186266,Leeds 2023 media coverage 23.09.22-17.10.22.csv,2022-10-17,02/10/2022
2022-10-02,Rugby League World Cup: Cultural Festival volunteer performers wanted,Usa Jaun News,0,0.0,POS,Online,"Online, consumer",,Leeds 2023,8984269082513127095,Leeds 2023 media coverage 23.09.22-17.10.22.csv,2022-10-17,02/10/2022
2022-10-02,Rugby League World Cup: Cultural Festival volunteer performers wanted,Yorkshire Evening Post - Yorkshireeveningpost.co.uk,0,237450.0,POS,Online,"Online, consumer",Local,Leeds 2023,2471554778595863099,Leeds 2023 media coverage 23.09.22-17.10.22.csv,2022-10-17,02/10/2022
2022-10-02,Rugby League World Cup: Cultural Festival volunteer performers wanted,"Yorkshire Post - yorkshirepost.co.uk, The",0,256221.0,POS,Online,"Online, consumer",Regional,Leeds 2023,4752019408736578376,Leeds 2023 media coverage 23.09.22-17.10.22.csv,2022-10-17,02/10/2022
2022-10-02,"The Jamaica Society Leeds reveals ""Out of Many Lit"" programme",Repeating Islands,0,0.0,POS,Online,"Blog, consumer",International,Leeds 2023,10188427808110615690,Leeds 2023 media coverage 23.09.22-17.10.22.csv,2022-10-17,02/10/2022
2022-10-05,LEEDS 2023 breaks down inclusion barriers to arts and culture with user-centred design,24HTECH,0,43253.0,NEU,Online,"Online, consumer",,Leeds 2023,9691978648245426411,Leeds 2023 media coverage 23.09.22-17.10.22.csv,2022-10-17,05/10/2022
2022-10-05,LEEDS 2023 breaks down inclusion barriers to arts and culture with user-centred design,North East Connected,0,30524.0,NEU,Online,"Online, consumer",Regional,Leeds 2023,5344632748017831303,Leeds 2023 media coverage 23.09.22-17.10.22.csv,2022-10-17,05/10/2022
2022-10-05,LEEDS 2023 breaks down inclusion barriers to arts and culture with user-centred design,Vietname Explorer,0,204240.0,NEU,Online,"Online, consumer",,Leeds 2023,16078871721531445577,Leeds 2023 media coverage 23.09.22-17.10.22.csv,2022-10-17,05/10/2022
2022-10-05,LEEDS 2023 breaks down inclusion barriers to arts and culture with user-centred design -,UK Tech News,0,5000.0,NEU,Online,"Online, consumer",,Leeds 2023,17936181448229777497,Leeds 2023 media coverage 23.09.22-17.10.22.csv,2022-10-17,05/10/2022
2022-10-06,Bruntwood named headline sponsor,"Yorkshire Post, The",21817,0.0,POS,Newspaper,"Newspaper, community",Regional,Leeds 2023,6635100490988137242,Leeds 2023 media coverage 23.09.22-17.10.22.csv,2022-10-17,06/10/2022
2022-10-06,Contact at 50: the Manchester theatre that is a beacon for young people,"Stage, The",9489,0.0,POS,Magazine,"Magazine, consumer",,Leeds 2023,1193998870895013013,Leeds 2023 media coverage 23.09.22-17.10.22.csv,2022-10-17,06/10/2022
2022-10-07,'Police had said they are perfectly legal': Birdbox disguised as a speed camera spotted on Meanwood Road,Head Topics,0,0.0,POS,Online,"Online, consumer",,Leeds 2023,13459277006137274395,Leeds 2023 media coverage 23.09.22-17.10.22.csv,2022-10-17,07/10/2022
2022-10-07,Artists install bird box disguised as a speed camera on Yorkshire street with 30mph limit,"Yorkshire Post - yorkshirepost.co.uk, The",0,256221.0,NEU,Online,"Online, consumer",Regional,Leeds 2023,17216097783874426963,Leeds 2023 media coverage 23.09.22-17.10.22.csv,2022-10-17,07/10/2022
2022-10-07,Relighting community bonfire nights,South Leeds Life,0,1687.0,NEU,Online,"Online, consumer",,Leeds 2023,6670964624308993898,Leeds 2023 media coverage 23.09.22-17.10.22.csv,2022-10-17,07/10/2022
2022-10-07,Volunteering in Leeds,"Gryphon - www.thegryphon.co.uk, The",0,12178.0,POS,Online,"Online, consumer",,Leeds 2023,17068141301730612384,Leeds 2023 media coverage 23.09.22-17.10.22.csv,2022-10-17,07/10/2022
2022-10-08,'Speed camera' puts brakes on drivers,Yorkshire Evening Post,36512,0.0,NEU,Newspaper,"Newspaper, community",,Leeds 2023,6549429862074916608,Leeds 2023 media coverage 23.09.22-17.10.22.csv,2022-10-17,08/10/2022
2022-10-08,Birdbox disguised as a speed camera spotted on Meanwood Road,Yorkshire Evening Post - Yorkshireeveningpost.co.uk,0,237450.0,NEU,Online,"Online, consumer",,Leeds 2023,5517284780461596472,Leeds 2023 media coverage 23.09.22-17.10.22.csv,2022-10-17,08/10/2022
2022-10-11,Volunteering in Leeds - The Gryphon,"Gryphon - www.thegryphon.co.uk, The",0,12178.0,POS,Online,"Online, consumer",,Leeds 2023,14421235207028782481,Leeds 2023 media coverage 23.09.22-17.10.22.csv,2022-10-17,11/10/2022
2022-10-13,RLWC Cultural Festival | The Power of Performance: This is Us,HAPPENINGNEXT,0,0.0,POS,Online,"Online, consumer",,Leeds 2023,6141624435666156219,Leeds 2023 media coverage 23.09.22-17.10.22.csv,2022-10-17,13/10/2022
2022-10-13,Yorkshire: The UK's County of Culture,"Gryphon - www.thegryphon.co.uk, The",0,12178.0,NEU,Online,"Online, consumer",,Leeds 2023; The Awakening,3783205930391647033,Leeds 2023 media coverage 23.09.22-17.10.22.csv,2022-10-17,13/10/2022
2022-10-14,"Investing in sport and culture can transform Yorkshire's economy, Turner & Townsend roundtable is told","Yorkshire Post - yorkshirepost.co.uk, The",0,256221.0,POS,Online,"Online, consumer",,Leeds 2023,17815456375337140049,Leeds 2023 media coverage 23.09.22-17.10.22.csv,2022-10-17,14/10/2022
2022-10-17,Chef Liz Cottam shares inspiration as spectacular Headingley Stadium event tickets up for grabs,Head Topics,0,0.0,NEU,Online,"Online, consumer",,Leeds 2023; The Awakening,3161811016324494349,Leeds 2023 media coverage 23.09.22-17.10.22.csv,2022-10-17,17/10/2022
2022-10-17,Chef Liz Cottam shares inspiration as spectacular Headingley Stadium event tickets up for grabs,Yorkshire Evening Post - Yorkshireeveningpost.co.uk,0,237450.0,POS,Online,"Online, consumer",,Leeds 2023; Leeds 2023 tickets; Leeds ticket ballot; The Awakening,1219469861590699854,Leeds 2023 media coverage 23.09.22-17.10.22.csv,2022-10-17,17/10/2022
2022-11-18,Bramley band 'gives youths something to belong to',West Leeds Dispatch,0,3141.0,NEU,Online,,,Leeds City of Culture,3095952077664144116,Leeds 2023 weekly media coverage 24.11.22.csv,2022-11-24,18/11/2022
2022-11-18,Here are the new acts announced for the Leeds2023 opening ceremony at Headingley Stadium,Yorkshire Evening Post - Yorkshireeveningpost.co.uk,0,237450.0,POS,Online,,,Leeds 2023; The Awakening,3441577697842884866,Leeds 2023 weekly media coverage 24.11.22.csv,2022-11-24,18/11/2022
2022-11-18,Leeds construction activity soars to highest level in 15 years,Construction Enquirer,0,59211.0,POS,Online,,,Leeds 2023,17096060873068331735,Leeds 2023 weekly media coverage 24.11.22.csv,2022-11-24,18/11/2022
2022-11-18,RLWC Cultural Festival | The Power of Performance: This is Us,HAPPENINGNEXT,0,0.0,POS,Online,,,Leeds 2023,515587328029661445,Leeds 2023 weekly media coverage 24.11.22.csv,2022-11-24,18/11/2022
2022-11-18,What the TV presenter Gabby Logan loves about Yorkshire,hertfordshire.greatbritishlife.co.uk,0,500.0,POS,Online,,,Leeds 2023; The Awakening,6369366020135309553,Leeds 2023 weekly media coverage 24.11.22.csv,2022-11-24,18/11/2022
2022-11-19,FIVE REASONS WHY LEEDS &amp; YORKSHIRE SHOULD BE ON YOUR INVESTMENT RADAR,Business Daily Media,0,960.0,POS,Online,,,Leeds 2023,5779943444149343643,Leeds 2023 weekly media coverage 24.11.22.csv,2022-11-24,19/11/2022
2022-11-21,New acts ready for Leeds 2023,Yorkshire Evening Post,36512,0.0,POS,Newspaper,,,Leeds 2023; The Awakening,4096557970019676338,Leeds 2023 weekly media coverage 24.11.22.csv,2022-11-24,21/11/2022
2022-11-21,New exhibition explores Brutalist architecture,University of Leeds,492369,0.0,POS,Online,,,Leeds 2023,8662415685696361886,Leeds 2023 weekly media coverage 24.11.22.csv,2022-11-24,21/11/2022
2022-11-22,Drop off your Leeds 2023 artwork at these West Leeds locations,West Leeds Dispatch,0,3141.0,NEU,Online,,,Leeds 2023; The Awakening,14226059130057450476,Leeds 2023 weekly media coverage 24.11.22.csv,2022-11-24,22/11/2022
2022-11-22,Inner South Youth Summit 2022,South Leeds Life,0,1687.0,POS,Online,,,Leeds 2023,15513728145048576992,Leeds 2023 weekly media coverage 24.11.22.csv,2022-11-24,22/11/2022
2022-11-23,Leeds Breeds Good Seeds - The Leeds Music Scene,Leeds Homepage - Leeds Discover the real Leeds.,0,0.0,POS,Online,,,Leeds City of Culture,9947529710203182256,Leeds 2023 weekly media coverage 24.11.22.csv,2022-11-24,23/11/2022
2022-11-24,Drop off your Leeds 2023 artwork at these West Leeds locations,West Leeds Dispatch,0,3141.0,POS,Online,,,Leeds 2023; The Awakening,2450391581434274872,Leeds 2023 weekly media coverage 24.11.22.csv,2022-11-24,24/11/2022
2022-11-24,KPMG Leeds Expands Partner Group As It Continues Growth In Region,"Yorkshire Times, The",0,5564.0,POS,Online,,,Leeds 2023,15842104553849922150,Leeds 2023 weekly media coverage 24.11.22.csv,2022-11-24,24/11/2022
2022-11-24,KPMG Leeds expands partner group,Insider Media,0,91697.0,POS,Online,,,Leeds 2023,14940418850198669270,Leeds 2023 weekly media coverage 24.11.22.csv,2022-11-24,24/11/2022
2022-11-24,Radio clip from BBC Leeds at 2022-11-23 19:12:31.000,BBC Radio Leeds,78000,0.0,POS,Broadcast,,,Leeds 2023; The Awakening,10059090577485792410,Leeds 2023 weekly media coverage 24.11.22.csv,2022-11-24,24/11/2022
2022-11-24,Radio clip from BBC Leeds at 2022-11-23 19:17:35.000,BBC Radio Leeds,78000,0.0,POS,Broadcast,,,Leeds 2023; The Awakening,1569001897443931337,Leeds 2023 weekly media coverage 24.11.22.csv,2022-11-24,24/11/2022
2022-11-24,Radio clip from BBC Leeds at 2022-11-23 19:35:00.000,BBC Radio Leeds,78000,0.0,NEU,Broadcast,,,Leeds 2023; The Awakening,9638177427336814979,Leeds 2023 weekly media coverage 24.11.22.csv,2022-11-24,24/11/2022
2022-11-24,Radio clip from BBC Leeds at 2022-11-23 21:27:36.000,BBC Radio Leeds,78000,0.0,NEU,Broadcast,,,Leeds 2023; The Awakening,11688228675466726581,Leeds 2023 weekly media coverage 24.11.22.csv,2022-11-24,24/11/2022
2022-11-24,Youth has say on democracy,Yorkshire Evening Post,36512,0.0,POS,Newspaper,,,Leeds 2023,12523732336562220848,Leeds 2023 weekly media coverage 24.11.22.csv,2022-11-24,24/11/2022
2022-11-26,ARTS DIARY,"Yorkshire Post, The",21817,0.0,POS,Newspaper,,Regional,Leeds 2023; The Awakening,11103412850726663963,Leeds 2023 weekly media coverage 02.12.22.csv,2022-12-02,26/11/2022
2022-11-28,Dawn Butler MP and Rachna Sundaram Join National Youth Theatre Board Of Trustees,Broadway World,0,467374.0,POS,Online,,International,Leeds 2023,1300239658610126996,Leeds 2023 weekly media coverage 02.12.22.csv,2022-12-02,28/11/2022
2022-11-28,Dawn Butler MP and Rachna Sundaram join National Youth Theatre Board of Trustees,Theatre Weekly,0,3312.0,POS,Online,,Trade,Leeds 2023,3061131774713820459,Leeds 2023 weekly media coverage 02.12.22.csv,2022-12-02,28/11/2022
2022-11-29,Bird box resembling speed camera found dumped in undergrowth near Meanwood Beck,Head Topics,0,0.0,POS,Online,,International,Leeds 2023,1778800080780593396,Leeds 2023 weekly media coverage 02.12.22.csv,2022-12-02,29/11/2022
2022-11-29,Bird box resembling speed camera found dumped in undergrowth near Meanwood Beck,Yorkshire Evening Post - Yorkshireeveningpost.co.uk,0,237450.0,POS,Online,,Local,Leeds 2023,12927888042848512093,Leeds 2023 weekly media coverage 02.12.22.csv,2022-12-02,29/11/2022
2022-11-29,"Leeds 2023 kicks off on 7 January with 'The Awakening', a live show at Headingley Stadium. Among the performances will be rapper Ntantu, backed by a 20-piece Gospel choir as they perform 'Tomorrow'.",MSN UK,0,63510000.0,NEU,Online,,Trade,Leeds 2023; The Awakening,2713633129566846678,Leeds 2023 weekly media coverage 02.12.22.csv,2022-12-02,29/11/2022
2022-11-29,Opinion: Farsley set for its best year in 2023?,West Leeds Dispatch,0,3141.0,POS,Online,,Local,Leeds 2023,18238066799428771133,Leeds 2023 weekly media coverage 02.12.22.csv,2022-12-02,29/11/2022
2022-11-30,Best destinations in the UK for 2023 named,Besttraveltale,0,0.0,POS,Online,,International,,12444744586912771421,Leeds 2023 weekly media coverage 02.12.22.csv,2022-12-02,30/11/2022
2022-11-30,Best destinations in the UK for 2023 named,Daily Express - express.co.uk,0,10338157.0,POS,Online,,National,,16427594023564244629,Leeds 2023 weekly media coverage 02.12.22.csv,2022-12-02,30/11/2022
2022-11-30,Best destinations in the UK for 2023 named,Newslanes,0,0.0,POS,Online,,International,,10477903500392157335,Leeds 2023 weekly media coverage 02.12.22.csv,2022-12-02,30/11/2022
2022-11-30,Best destinations in the UK for 2023 named,TechiAzi,0,0.0,POS,Online,,International,,17308537669897408042,Leeds 2023 weekly media coverage 02.12.22.csv,2022-12-02,30/11/2022
2022-11-30,Bird box 'speed camera' uprooted and dumped,Yorkshire Evening Post,36512,0.0,POS,Newspaper,,Local,Leeds 2023,18165471026260195941,Leeds 2023 weekly media coverage 02.12.22.csv,2022-12-02,30/11/2022
2022-11-30,Leading Outdoor Arts Specialists Without Walls Announce Partnership With LEEDS 2023 And Programme Highlights,Broadway World,0,467374.0,POS,Online,,International,Leeds 2023,14295832649547268376,Leeds 2023 weekly media coverage 02.12.22.csv,2022-12-02,30/11/2022
2022-11-30,Leeds 2023 to partner with outdoor arts consortium Without Walls,"Stage - thestage.co.uk, The",0,77594.0,POS,Online,,National,Leeds 2023,14091877813436783443,Leeds 2023 weekly media coverage 02.12.22.csv,2022-12-02,30/11/2022
2022-11-30,Radio clip from BBC Leeds at 2022-11-30 06:37:20.000,BBC Radio Leeds,78000,0.0,POS,Broadcast,,Regional,Leeds 2023,15514091341305597744,Leeds 2023 weekly media coverage 02.12.22.csv,2022-12-02,30/11/2022
2022-11-30,Radio clip from BBC Leeds at 2022-11-30 06:53:45.000,BBC Radio Leeds,78000,0.0,NEU,Broadcast,,Regional,Leeds 2023,17518867693380664583,Leeds 2023 weekly media coverage 02.12.22.csv,2022-12-02,30/11/2022
2022-11-30,Scottish destination named one of the best places to travel in 2023 - 'thrilling&amp;#039;,Vietname Explorer,0,204240.0,POS,Online,,International,,12864646861467807610,Leeds 2023 weekly media coverage 02.12.22.csv,2022-12-02,30/11/2022
2022-11-30,Scottish destination named one of the best places to travel in 2023 - 'thrilling',Usatodaypost,0,0.0,POS,Online,,International,,6321138400836583164,Leeds 2023 weekly media coverage 02.12.22.csv,2022-12-02,30/11/2022
2022-11-30,Staycation inspiration as full list of best places to travel in 2023 named,Pedfire,0,24364.0,POS,Online,,International,,6350075815993194178,Leeds 2023 weekly media coverage 02.12.22.csv,2022-12-02,30/11/2022
2022-11-30,Staycation inspiration as full list of best places to travel in 2023 named,Samachar Central,0,8095.0,POS,Online,,International,,18233543526590912232,Leeds 2023 weekly media coverage 02.12.22.csv,2022-12-02,30/11/2022
2022-12-01,"CGIs reveal new look for ""much safer and cleaner"" City Square in Leeds",Bdaily,0,39592.0,POS,Online,,Trade,Leeds 2023,703556331938474691,Leeds 2023 weekly media coverage 02.12.22.csv,2022-12-02,01/12/2022
2022-12-01,City Square: Visuals of completed highways scheme released,Leeds City Council News - News,0,0.0,POS,Online,,Local,Leeds 2023,9815660727718319811,Leeds 2023 weekly media coverage 02.12.22.csv,2022-12-02,01/12/2022
2022-12-01,City Square: Visuals of completed highways scheme released - Harrogate Informer,Harrogate News,0,8776.0,POS,Online,,Local,Leeds 2023,16937456741915085286,Leeds 2023 weekly media coverage 02.12.22.csv,2022-12-02,01/12/2022
2022-12-01,Leeds city square: what it will look like on completion,Topic UK,0,0.0,NEU,Online,,Regional,Leeds 2023,7271841618947468995,Leeds 2023 weekly media coverage 02.12.22.csv,2022-12-02,01/12/2022
2022-12-01,New CGI images offer first look at design for pedestrianised Leeds City Square gateway 'The Glade',Yorkshire Evening Post - Yorkshireeveningpost.co.uk,0,237450.0,NEU,Online,,Local,Leeds 2023,14294758466810141386,Leeds 2023 weekly media coverage 02.12.22.csv,2022-12-02,01/12/2022
2022-12-02,Leeds City Square transformation plan in photos after months of roadworks,Leeds Live,0,220262.0,NEU,Online,,Local,Leeds 2023,11986745684253292033,Leeds 2023 weekly media coverage 02.12.22.csv,2022-12-02,02/12/2022
2022-12-02,The Rough Guide to the best travel destinations in 2023,Rough Guides,0,212587.0,POS,Online,,International,Leeds 2023,4813289840060448241,Leeds 2023 weekly media coverage 02.12.22.csv,2022-12-02,02/12/2022
2022-12-02,Leeds City Square transformation plan in photos after months of roadworks,Leeds Live,0,220262.0,NEU,Online,,Local,Leeds 2023,11986745684253292033,Leeds 2023 weekly media coverage 09.12.22.csv,2022-12-09,02/12/2022
2022-12-02,Long-term benefits promised as city gateway is transformed,TheBusinessDesk.com - TheBusinessDesk.com (Yorkshire),0,43802.0,POS,Online,,Regional; Trade,Leeds 2023,13284506668862180534,Leeds 2023 weekly media coverage 09.12.22.csv,2022-12-09,02/12/2022
2022-12-02,New Images Unveiled Of City Square In Leeds,Timber in Construction - Online,0,40983.0,POS,Online,,National; Trade,Leeds 2023,10325830287655696567,Leeds 2023 weekly media coverage 09.12.22.csv,2022-12-09,02/12/2022
2022-12-02,Radio clip from Times Radio at 2022-12-02 15:50:04.000,Times Radio,0,0.0,NEU,Broadcast,,National,Leeds 2023,16320297509576226812,Leeds 2023 weekly media coverage 09.12.22.csv,2022-12-09,02/12/2022
2022-12-02,Radio clip from Times Radio at 2022-12-02 15:55:04.000,Times Radio,0,0.0,NEU,Broadcast,,National,Leeds 2023,17254252805594902004,Leeds 2023 weekly media coverage 09.12.22.csv,2022-12-09,02/12/2022
2022-12-02,The Rough Guide to the best travel destinations in 2023,Rough Guides,0,212587.0,POS,Online,,International; National,Leeds 2023,7649611582794603544,Leeds 2023 weekly media coverage 09.12.22.csv,2022-12-09,02/12/2022
2022-12-03,Singers recording Ntantu's track Tomorrow which will be part of The Awakening at the launch of Leeds 2023,MSN UK,0,63510000.0,NEU,Online,,National,Leeds 2023; The Awakening,9955726992910437115,Leeds 2023 weekly media coverage 09.12.22.csv,2022-12-09,03/12/2022
2022-12-05,"2023. Leeds Beckett University, a Principal Education Partner of LEEDS 2023, will host the event on Friday, 24th February",Record of the Day,0,3702.0,POS,Online,,,Leeds 2023,11057588000543230817,Leeds 2023 weekly media coverage 09.12.22.csv,2022-12-09,05/12/2022
2022-12-05,In the studio with rapper Ntantu as Leeds 2023 announces its ticket ballot results,Yorkshire Evening Post - Yorkshireeveningpost.co.uk,0,237450.0,POS,Online,,Local,Leeds 2023; The Awakening,13933685740643784845,Leeds 2023 weekly media coverage 09.12.22.csv,2022-12-09,05/12/2022
2022-12-05,Luxury fashion brand Burberry partners with LEEDS 2023 to celebrate year of culture,"Yorkshire Post - yorkshirepost.co.uk, The",0,256221.0,POS,Online,,Regional,Leeds 2023; The Awakening,6139460302366085270,Leeds 2023 weekly media coverage 09.12.22.csv,2022-12-09,05/12/2022
2022-12-05,Yorkshire Has Made It Into Condé Nast's 13 Best Places To Visit In The UK For 2023,News Central Site,0,0.0,POS,Online,,International,,2008327659271682502,Leeds 2023 weekly media coverage 09.12.22.csv,2022-12-09,05/12/2022
2022-12-06,Bectu signs MoU to ensure fair wages and working conditions at LEEDS 2023,Broadcasting Entertainment Cinematograph and Theatre Union (BECTU) - Online,0,14298.0,POS,Online,,,Leeds 2023,14398828304894317877,Leeds 2023 weekly media coverage 09.12.22.csv,2022-12-09,06/12/2022
2022-12-06,Burberry links with Leeds 2023 to celebrate culture in West Yorkshire,Fashion Network Hong Kong,0,518.0,POS,Online,,International,Leeds 2023,8226727284324829874,Leeds 2023 weekly media coverage 09.12.22.csv,2022-12-09,06/12/2022
2022-12-06,Burberry links with Leeds 2023 to celebrate culture in West Yorkshire,FashionNetwork (PH),0,0.0,POS,Online,,International,Leeds 2023,18004482120455729537,Leeds 2023 weekly media coverage 09.12.22.csv,2022-12-09,06/12/2022
2022-12-06,Burberry links with Leeds 2023 to celebrate culture in West Yorkshire,Fashionnetwork (NL),0,5000.0,POS,Online,,International,Leeds 2023,9556441612908542171,Leeds 2023 weekly media coverage 09.12.22.csv,2022-12-09,06/12/2022
2022-12-06,Burberry teams up with Leeds to celebrate year of culture,Fashion United (NZ),0,274.0,POS,Online,,International,Leeds 2023,14214955108790183680,Leeds 2023 weekly media coverage 09.12.22.csv,2022-12-09,06/12/2022
2022-12-06,Burberry teams up with Leeds to celebrate year of culture,FashionUnited,0,46814.0,POS,Online,,International,Leeds 2023,2350247007761912857,Leeds 2023 weekly media coverage 09.12.22.csv,2022-12-09,06/12/2022
2022-12-06,Burberry teams up with Leeds to celebrate year of culture,FashionUnited - United Kingdom,0,73367.0,POS,Online,,National,Leeds 2023,3912766606414522567,Leeds 2023 weekly media coverage 09.12.22.csv,2022-12-09,06/12/2022
2022-12-06,Burberry teams up with Leeds to celebrate year of culture,Fashionunited.in,0,5084.0,POS,Online,,International,Leeds 2023,4903012068449836869,Leeds 2023 weekly media coverage 09.12.22.csv,2022-12-09,06/12/2022
2022-12-06,Burberry teams up with Leeds to celebrate year of culture,Glam Touch,0,486.0,POS,Online,,International,Leeds 2023,14825162522058332514,Leeds 2023 weekly media coverage 09.12.22.csv,2022-12-09,06/12/2022
2022-12-06,Burberry teams up with Leeds to celebrate year of culture,Pour Elles,0,166.0,POS,Online,,International,Leeds 2023,1494390601730001228,Leeds 2023 weekly media coverage 09.12.22.csv,2022-12-09,06/12/2022
2022-12-06,Burberry teams up with Leeds to celebrate year of culture,Top Fash,0,226.0,POS,Online,,International,Leeds 2023,7592050277969335132,Leeds 2023 weekly media coverage 09.12.22.csv,2022-12-09,06/12/2022
2022-12-06,Burberry teams up with Leeds to celebrate year of culture,fashionunited.info,0,2344.0,POS,Online,,International,Leeds 2023,8419142328557542031,Leeds 2023 weekly media coverage 09.12.22.csv,2022-12-09,06/12/2022
2022-12-06,Burberry to partner City of Culture events,"Yorkshire Post, The",21817,0.0,POS,Newspaper,,Regional,Leeds 2023; The Awakening,12561449362596506149,Leeds 2023 weekly media coverage 09.12.22.csv,2022-12-09,06/12/2022
2022-12-06,Launchpad and PRS Foundation announce a joint 2023 Talent Development Conference,Record of the Day,0,3702.0,POS,Online,,,Leeds 2023,15568593091183286427,Leeds 2023 weekly media coverage 09.12.22.csv,2022-12-09,06/12/2022
2022-12-06,Launchpad and PRS Foundation announce joint Talent Development Conference,m-magazine.co.uk,0,500.0,POS,Online,,,Leeds 2023,16485716276624357514,Leeds 2023 weekly media coverage 09.12.22.csv,2022-12-09,06/12/2022
2022-12-06,Leeds 2023 opening show ballot results,Yorkshire Evening Post,36512,0.0,POS,Newspaper,,Local,Leeds 2023; The Awakening,582271136809677247,Leeds 2023 weekly media coverage 09.12.22.csv,2022-12-09,06/12/2022
2022-12-06,Leeds 2023 signs fair pay agreement with creative unions,"Stage - thestage.co.uk, The",0,77594.0,POS,Online,,National,Leeds 2023,12021945140424228564,Leeds 2023 weekly media coverage 09.12.22.csv,2022-12-09,06/12/2022
2022-12-06,Leeds 2023 signs fair pay union agreement,ArtsProfessional,0,13218.0,NEU,Online,,National; Trade,Leeds 2023,4600031986967216712,Leeds 2023 weekly media coverage 09.12.22.csv,2022-12-09,06/12/2022
2022-12-06,Leeds Culture Trust signs union agreement,ArtsProfessional,0,13218.0,NEU,Online,,National; Trade,Leeds 2023,2044395245005816478,Leeds 2023 weekly media coverage 09.12.22.csv,2022-12-09,06/12/2022
2022-12-06,Six-figure boost for Leeds 2023 creative education scheme,Yorkshire Evening Post,36512,0.0,POS,Newspaper,,Local,Leeds 2023; The Awakening,2706163347569872553,Leeds 2023 weekly media coverage 09.12.22.csv,2022-12-09,06/12/2022
2022-12-07,Burberry celebrates community with Leeds,Fashionating World,0,3887.0,POS,Online,,International,Leeds 2023; The Awakening,2950417857632551304,Leeds 2023 weekly media coverage 09.12.22.csv,2022-12-09,07/12/2022
2022-12-07,Burberry links with Leeds 2023 to celebrate culture in West Yorkshire,Ae Fashionnetwork,0,690.0,POS,Online,,International,Leeds 2023,7140665712428264566,Leeds 2023 weekly media coverage 09.12.22.csv,2022-12-09,07/12/2022
2022-12-07,Burberry links with Leeds 2023 to celebrate culture in West Yorkshire,Fashion Jobs,0,500.0,POS,Online,,International,Leeds 2023,16600518634456274438,Leeds 2023 weekly media coverage 09.12.22.csv,2022-12-09,07/12/2022
2022-12-07,Burberry links with Leeds 2023 to celebrate culture in West Yorkshire,Fashion Network (SE),0,5000.0,POS,Online,,International,Leeds 2023,332769418127701575,Leeds 2023 weekly media coverage 09.12.22.csv,2022-12-09,07/12/2022
2022-12-07,Burberry links with Leeds 2023 to celebrate culture in West Yorkshire,Fashion Network (UK),0,21993.0,POS,Online,,,Leeds 2023,8188636219934853615,Leeds 2023 weekly media coverage 09.12.22.csv,2022-12-09,07/12/2022
2022-12-07,Burberry links with Leeds 2023 to celebrate culture in West Yorkshire,Fashion Network Australia,0,334.0,POS,Online,,International,Leeds 2023,13033572254422997533,Leeds 2023 weekly media coverage 09.12.22.csv,2022-12-09,07/12/2022
2022-12-07,Burberry links with Leeds 2023 to celebrate culture in West Yorkshire,FashionNetwork - Singapore,0,152.0,POS,Online,,International,Leeds 2023,12288259114102880326,Leeds 2023 weekly media coverage 09.12.22.csv,2022-12-09,07/12/2022
2022-12-07,Burberry links with Leeds 2023 to celebrate culture in West Yorkshire,News - FashionNetwork.com Egypt,0,0.0,POS,Online,,International,Leeds 2023,1835617946592331644,Leeds 2023 weekly media coverage 09.12.22.csv,2022-12-09,07/12/2022
2022-12-07,Burberry links with Leeds 2023 to celebrate culture in West Yorkshire,News - FashionNetwork.com Israel,0,0.0,POS,Online,,International,Leeds 2023,10597720701378845060,Leeds 2023 weekly media coverage 09.12.22.csv,2022-12-09,07/12/2022
2022-12-07,Burberry to partner City of Culture events,Yorkshire Evening Post,36512,0.0,POS,Newspaper,,Local,Leeds 2023; The Awakening,14856955256163208688,Leeds 2023 weekly media coverage 09.12.22.csv,2022-12-09,07/12/2022
2022-12-07,LEEDS 2023 – CEO Kully Thiarai: 'The Awakening' show will light a torch of creativity for the year ahead,Asian Culture Vulture,0,1602.0,POS,Online,,,Leeds 2023; The Awakening,4156057973068301329,Leeds 2023 weekly media coverage 09.12.22.csv,2022-12-09,07/12/2022
2022-12-07,Partnerschaft mit LEEDS 2023,Fashion Today,0,1762.0,NEU,Online,,International,Leeds 2023,7617250125101105317,Leeds 2023 weekly media coverage 09.12.22.csv,2022-12-09,07/12/2022
2022-12-08,Burberry renforce sa position dans la culture et l'éducation.,JOURNAL DU LUXE,0,20124.0,NEU,Online,,International,Leeds 2023; The Awakening,13580963863094849521,Leeds 2023 weekly media coverage 09.12.22.csv,2022-12-09,08/12/2022
2022-12-08,Burberry strengthens its position in culture and education.,Archynetys.com,0,161.0,POS,Online,,International,Leeds 2023; The Awakening,9551816823826045685,Leeds 2023 weekly media coverage 09.12.22.csv,2022-12-09,08/12/2022
2022-12-09,Radio clip from BBC Leeds at 2022-12-09 07:30:01.000,BBC Radio Leeds,78000,0.0,NEU,Broadcast,,Regional,Leeds 2023; The Awakening,5086316236061734873,Leeds 2023 weekly media coverage 09.12.22.csv,2022-12-09,09/12/2022
2022-12-09,Radio clip from BBC Leeds at 2022-12-09 07:40:03.000,BBC Radio Leeds,78000,0.0,POS,Broadcast,,Regional,Leeds 2023; The Awakening,7980876321182147062,Leeds 2023 weekly media coverage 09.12.22.csv,2022-12-09,09/12/2022
2022-12-12,GOLDBERG VARIATIONS Comes to Leeds in March 2023,Broadway World,0,467374.0,POS,Online,,International,Leeds 2023,2715896878613034227,Leeds 2023 weekly media coverage 16.12.22.csv,2022-12-16,12/12/2022
2022-12-13,'Magnificent' British city named best destination for 2023,Besttraveltale,0,0.0,NEU,Online,,International,The Awakening,11439053934869667750,Leeds 2023 weekly media coverage 16.12.22.csv,2022-12-16,13/12/2022
2022-12-13,'Magnificent' British city named best destination for 2023,Daily Express - express.co.uk,0,10338157.0,NEU,Online,,National,The Awakening,2695534202773466578,Leeds 2023 weekly media coverage 16.12.22.csv,2022-12-16,13/12/2022
2022-12-13,'Magnificent' British city named best destination for 2023,Newslanes,0,0.0,POS,Online,,International,The Awakening,16106480453515962097,Leeds 2023 weekly media coverage 16.12.22.csv,2022-12-16,13/12/2022
2022-12-13,'Magnificent' British city named one of the best destinations for 2023 - it's not London,Usatodaypost,0,0.0,POS,Online,,International,The Awakening,7853385009482183622,Leeds 2023 weekly media coverage 16.12.22.csv,2022-12-16,13/12/2022
2022-12-13,'Magnificent' British city named one of the best destinations for 2023 - it's not London,Vietname Explorer,0,204240.0,NEU,Online,,International,The Awakening,17499981774447164439,Leeds 2023 weekly media coverage 16.12.22.csv,2022-12-16,13/12/2022
2022-12-13,Leeds is one of the top ten 'best travel destinations in 2023',"Hoot, The",0,5000.0,POS,Online,,National,,13345744079526960976,Leeds 2023 weekly media coverage 16.12.22.csv,2022-12-16,13/12/2022
2022-12-15,Radio clip from BBC Leeds at 2022-12-14 19:07:10.000,BBC Radio Leeds,78000,0.0,POS,Broadcast,,Regional,The Awakening,16165553750725636536,Leeds 2023 weekly media coverage 16.12.22.csv,2022-12-16,15/12/2022
2022-12-16,LEEDS 2023 programme takes aim at delegate experiences,Meetings & Incentive Travel,0,1325.0,POS,Online,,National,Leeds 2023; The Awakening,7014237855064856010,Leeds 2023 weekly media coverage 16.12.22.csv,2022-12-16,16/12/2022
2022-12-16,Radio clip from BBC Leeds at 2022-12-15 21:38:05.000,BBC Radio Leeds,78000,0.0,POS,Broadcast,,Regional,Leeds 2023,13383098025526273025,Leeds 2023 weekly media coverage 16.12.22.csv,2022-12-16,16/12/2022
2022-12-16,LEEDS 2023 programme takes aim at delegate experiences,Meetings & Incentive Travel,0,1325.0,,,"Online, consumer",,Leeds 2023; The Awakening,5151267851630155735,Leeds 2023 weekly media coverage 23.12.22.csv,2022-12-23,12/16/2022
2022-12-16,Leeds is set to be the beating heart of UK culture in 2023,Topic UK,0,0.0,,,"Online, consumer",,Leeds 2023; Leeds Year Of Culture; The Awakening,3086387765780427680,Leeds 2023 weekly media coverage 23.12.22.csv,2022-12-23,12/16/2022
2022-12-16,Leeds is set to be the beating heart of UK culture in 2023,Yorkshire Business Woman,0,0.0,,,"Online, consumer",,Leeds 2023; Leeds Year Of Culture; The Awakening,16591632462045311804,Leeds 2023 weekly media coverage 23.12.22.csv,2022-12-23,12/16/2022
2022-12-16,Radio clip from BBC Leeds at 2022-12-15 21:38:05.000,BBC Radio Leeds,78000,0.0,,,Radio station,,Leeds 2023,12540135241595561654,Leeds 2023 weekly media coverage 23.12.22.csv,2022-12-23,12/16/2022
2022-12-16,Solberg reveals Skoda WRC2 programme for 2023,Auto Breaking News,0,381.0,,,"Online, consumer",,Leeds 2023,13619953133224939577,Leeds 2023 weekly media coverage 23.12.22.csv,2022-12-23,12/16/2022
2022-12-17,"Farsley: £1,150 raised and huge food haul donated in festive food bank drive",West Leeds Dispatch,0,3141.0,,,"Online, consumer",,Leeds 2023,6463406538035709243,Leeds 2023 weekly media coverage 23.12.22.csv,2022-12-23,12/17/2022
2022-12-21,Radio clip from BBC Leeds at 2022-12-21 07:48:12.000,BBC Radio Leeds,78000,0.0,,,Radio station,,The Awakening,5112238942274940758,Leeds 2023 weekly media coverage 23.12.22.csv,2022-12-23,12/21/2022
2022-12-21,Radio clip from BBC Leeds at 2022-12-21 07:53:13.000,BBC Radio Leeds,78000,0.0,,,Radio station,,Leeds 2023,18254090570446000866,Leeds 2023 weekly media coverage 23.12.22.csv,2022-12-23,12/21/2022
2022-12-21,Radio clip from BBC Leeds at 2022-12-21 07:58:14.000,BBC Radio Leeds,78000,0.0,,,Radio station,,The Awakening,10669301705566684181,Leeds 2023 weekly media coverage 23.12.22.csv,2022-12-23,12/21/2022
2022-12-23,Radio clip from BBC Radio 4 at 2022-12-22 19:55:53.000,BBC Radio 4,3280000,0.0,,,Radio network,,Leeds 2023,8738547276124560804,Leeds 2023 weekly media coverage 23.12.22.csv,2022-12-23,12/23/2022
2023-01-01,10 things you need to know about LEEDS2023,Yorkshire Life,13350,0.0,POS,Magazine,"Magazine, consumer",,Leeds 2023; The Awakening,8195715223850241146,Leeds 2023 weekly media coverage 1-6.01.23.csv,2023-01-06,01/01/2023
2023-01-01,"101 Things to look forward to in 2023…[CR-LF][CR-LF] By Moneymagpie Team[CR-LF] Posted on January 1, 2023 [CR-LF][CR-LF][CR-LF]No Comments",Moneymagpie.com,0,40976.0,POS,Online,"Online, consumer",,Leeds 2023; The Awakening,9463535073962440916,Leeds 2023 weekly media coverage 1-6.01.23.csv,2023-01-06,01/01/2023
2023-01-02,10 things you need to know about LEEDS 2023,Oracle,0,14729.0,POS,Online,"Online, trade/industry",,Leeds 2023; The Awakening,13935371880988627210,Leeds 2023 weekly media coverage 1-6.01.23.csv,2023-01-06,01/02/2023
2023-01-03,10 things you need to know about LEEDS 2023,Head Topics (UK),0,0.0,NEU,Online,"Online, consumer",,Leeds 2023,4166396712976187441,Leeds 2023 weekly media coverage 1-6.01.23.csv,2023-01-06,01/03/2023
2023-01-03,23 Reiseziele für 2023,SeeSicht Magazin,0,737.0,NEU,Online,"Online, consumer",International,,17958762494559505969,Leeds 2023 weekly media coverage 1-6.01.23.csv,2023-01-06,01/03/2023
2023-01-03,Business review of 2022: Chaos at heart of Government hit business hard,"Yorkshire Post - yorkshirepost.co.uk, The",0,256221.0,NEU,Online,"Online, consumer",,Leeds 2023,6679644010518444645,Leeds 2023 weekly media coverage 1-6.01.23.csv,2023-01-06,01/03/2023
2023-01-04,1ST EVER LEEDS AFRICAN INTERNATIONAL FESTIVAL TAKES PLACE THIS YEAR – DO NOT MISS IT,My Fernandez,0,0.0,POS,,,,Leeds 2023,9397094030619198665,Leeds 2023 weekly media coverage 1-6.01.23.csv,2023-01-06,01/04/2023
2023-01-04,"Best seats in West, from Bard to The Bodyguard","Yorkshire Post, The",21817,0.0,POS,Newspaper,"Newspaper, community",,Leeds 2023,3981817842952418011,Leeds 2023 weekly media coverage 1-6.01.23.csv,2023-01-06,01/04/2023
2023-01-04,Burberry links with Leeds 2023 to celebrate culture in West Yorkshire,Fashionnetwork (NL),0,5000.0,POS,Online,"Online, consumer",International,Leeds 2023,2505878286320182426,Leeds 2023 weekly media coverage 1-6.01.23.csv,2023-01-06,01/04/2023
2023-01-04,_ Ești A-OK în Marea Britanie! Cele mai bune evenimente și cazare pentru cazare pentru a rezerva în 2023 - crimes,Fluierul,0,0.0,,Online,"Online, consumer",International,Leeds 2023,4295782302705567028,Leeds 2023 weekly media coverage 1-6.01.23.csv,2023-01-06,01/04/2023
2023-01-05,A look ahead to some of the highlights coming up in West Yorkshire's theatres this year,"Yorkshire Post - yorkshirepost.co.uk, The",0,256221.0,POS,Online,"Online, consumer",,Leeds 2023,16096895448614046477,Leeds 2023 weekly media coverage 1-6.01.23.csv,2023-01-06,01/05/2023
2023-01-06,Awakening city to celebration of culture and togetherness,Yorkshire Evening Post,36512,0.0,POS,Newspaper,"Newspaper, community",,Leeds 2023; The Awakening,1954331321826369579,Leeds 2023 weekly media coverage 1-6.01.23.csv,2023-01-06,01/06/2023
2023-01-06,BBC London News,BBC One Yorkshire,824001,0.0,NEU,Broadcast,Television station,National,Leeds 2023,1115630100758077360,Leeds 2023 weekly media coverage 1-6.01.23.csv,2023-01-06,01/06/2023
2023-01-06,BBC London News,BBC One Yorkshire,824001,0.0,NEU,Broadcast,Television station,National,Leeds 2023; The Awakening,6674715408407995803,Leeds 2023 weekly media coverage 1-6.01.23.csv,2023-01-06,01/06/2023
2023-01-06,Breakfast,BBC One Yorks & Lincs,870001,0.0,NEU,Broadcast,Television station,,Leeds 2023; Leeds Year Of Culture,6832844515529495338,Leeds 2023 weekly media coverage 1-6.01.23.csv,2023-01-06,01/06/2023
2023-01-06,Breakfast,BBC One Yorkshire,824001,0.0,NEU,Broadcast,Television station,National,Leeds 2023; Leeds Year Of Culture,3889322020665303726,Leeds 2023 weekly media coverage 1-6.01.23.csv,2023-01-06,01/06/2023
2023-01-06,Breakfast,BBC One Yorkshire,824001,0.0,NEU,Broadcast,Television station,National,Leeds 2023; Leeds Year Of Culture,3889322020665303726,Leeds 2023 weekly media coverage 1-6.01.23.csv,2023-01-06,01/06/2023
2023-01-06,Census data reveals LGBT+ populations for first time,AutoTrade News,0,500.0,NEU,Online,"Online, trade/industry",National,Leeds 2023,14564866890505135170,Leeds 2023 weekly media coverage 1-6.01.23.csv,2023-01-06,01/06/2023
2023-01-06,China Covid: Young people self-infect as fears for elderly grow,AutoTrade News,0,500.0,NEU,Online,"Online, trade/industry",National,Leeds 2023,13802301047649105127,Leeds 2023 weekly media coverage 1-6.01.23.csv,2023-01-06,01/06/2023
2023-01-06,City's year of culture to bring 'lasting legacy',BBC News Online,0,24207801.0,NEU,Online,"Online, consumer",National,Leeds 2023; The Awakening,5523623124287751281,Leeds 2023 weekly media coverage 1-6.01.23.csv,2023-01-06,01/06/2023
2023-01-06,City's year of culture to bring 'lasting legacy',CRWE World,0,24972.0,POS,Online,"Online, consumer",International,Leeds 2023,13470520188864156562,Leeds 2023 weekly media coverage 1-6.01.23.csv,2023-01-06,01/06/2023
2023-01-06,City's year of culture to bring 'lasting legacy',One News Page,0,767422.0,POS,Online,"Online, consumer",,Leeds 2023,12701335983992585411,Leeds 2023 weekly media coverage 1-6.01.23.csv,2023-01-06,01/06/2023
2023-01-06,"Come to Leeds, home of artistic brilliance (honest!)","Times - thetimes.co.uk, The",0,3210000.0,NEU,Online,"Online, consumer",National,Leeds 2023; The Awakening,5104785171187264776,Leeds 2023 weekly media coverage 1-6.01.23.csv,2023-01-06,01/06/2023
2023-01-07,33 incredible things to look forward to in Leeds in 2023,Leeds Live,,216161.0,POS,Online,,,Leeds 2023,1059963878646067212,LEEDS 2023 The Awakening media coverage 7-9.01.23.csv,2023-01-09,07/01/2023
2023-01-07,BBC London News,BBC One Yorkshire,824001,0.0,NEU,Broadcast,,National,Leeds 2023; The Awakening,16853591215594458095,LEEDS 2023 The Awakening media coverage 7-9.01.23.csv,2023-01-09,07/01/2023
2023-01-07,Brexit Boost Propels Leeds To Become UK Tourism Hotspot,World News Era,,20920.0,NEU,Online,,International,Leeds 2023; The Awakening,8555705077814396592,LEEDS 2023 The Awakening media coverage 7-9.01.23.csv,2023-01-09,07/01/2023
2023-01-07,Brexit boost propels Leeds to become UK tourism hotspot,Daily Express - express.co.uk,,10338157.0,NEU,Online,,National,Leeds 2023; Leeds Year Of Culture; The Awakening,1379839131587797822,LEEDS 2023 The Awakening media coverage 7-9.01.23.csv,2023-01-09,07/01/2023
2023-01-07,Brexit boost propels Leeds to become UK tourism hotspot,Digitpatrox,,0.0,NEU,Online,,International,Leeds 2023; The Awakening,12457402577617525808,LEEDS 2023 The Awakening media coverage 7-9.01.23.csv,2023-01-09,07/01/2023
2023-01-07,Brexit boost propels Leeds to become UK tourism hotspot,Latest Trending News,,0.0,NEU,Online,,International,Leeds 2023; The Awakening,17015015502070680921,LEEDS 2023 The Awakening media coverage 7-9.01.23.csv,2023-01-09,07/01/2023
2023-01-07,Brexit boost propels Leeds to become UK tourism hotspot,Newslanes,,0.0,NEU,Online,,International,Leeds 2023; The Awakening,13718794209815764406,LEEDS 2023 The Awakening media coverage 7-9.01.23.csv,2023-01-09,07/01/2023
2023-01-07,COMMENT,Daily Express,241806,0.0,NEU,Newspaper,,National,Leeds 2023; Leeds Year Of Culture; The Awakening,14679330507531745651,LEEDS 2023 The Awakening media coverage 7-9.01.23.csv,2023-01-09,07/01/2023
2023-01-07,Channel 4 News,Channel 4,2821000,0.0,NEU,Broadcast,,National,Leeds 2023,5748533866246685565,LEEDS 2023 The Awakening media coverage 7-9.01.23.csv,2023-01-09,07/01/2023
2023-01-07,Cultural awakening,"Yorkshire Post, The",21817,0.0,POS,Newspaper,,,The Awakening,2504099961075970239,LEEDS 2023 The Awakening media coverage 7-9.01.23.csv,2023-01-09,07/01/2023
2023-01-07,Fireworks cancellations branded 'mean-spirited',Yorkshire Evening Post,36512,0.0,NEU,Newspaper,,,Leeds 2023,13625311722853356003,LEEDS 2023 The Awakening media coverage 7-9.01.23.csv,2023-01-09,07/01/2023
2023-01-07,First Bus Partners With LEEDS 2023 To Promote Sustainable Travel,Yorkshire Business Daily,,689.0,POS,Online,,,Leeds 2023; The Awakening,11165690815756665102,LEEDS 2023 The Awakening media coverage 7-9.01.23.csv,2023-01-09,07/01/2023
2023-01-07,ITV News London,ITV 1 Yorkshire West,790001,0.0,NEU,Broadcast,,,Leeds Year Of Culture; The Awakening,12975926060226028583,LEEDS 2023 The Awakening media coverage 7-9.01.23.csv,2023-01-09,07/01/2023
2023-01-07,Leeds 2023 Year of Culture will show off our passion and creativity to the world,Leeds Live,,216161.0,POS,Online,,,Leeds 2023; The Awakening,5745098290235025976,LEEDS 2023 The Awakening media coverage 7-9.01.23.csv,2023-01-09,07/01/2023
2023-01-07,Leeds 2023: city to kick off year-long festival with 'epic' opening ceremony,"Guardian - theguardian.com, The",,31717429.0,NEU,Online,,National,Leeds 2023; The Awakening,14193565458358588755,LEEDS 2023 The Awakening media coverage 7-9.01.23.csv,2023-01-09,07/01/2023
2023-01-07,Leeds 2023: city to kick off year-long festival with 'epic' opening ceremony,News Break,,1552000.0,NEU,Online,,International,Leeds 2023; The Awakening,14019074721802759067,LEEDS 2023 The Awakening media coverage 7-9.01.23.csv,2023-01-09,07/01/2023
2023-01-07,Leeds 2023: city to kick off year-long festival with 'epic' opening ceremony,Newzealand News,,4013.0,NEU,Online,,International,Leeds 2023,12498390392495547418,LEEDS 2023 The Awakening media coverage 7-9.01.23.csv,2023-01-09,07/01/2023
2023-01-07,Leeds 2023: city to kick off year-long festival with 'epic' opening ceremony,UK News To day,,0.0,NEU,Online,,International,Leeds 2023; The Awakening,16948553734668478371,LEEDS 2023 The Awakening media coverage 7-9.01.23.csv,2023-01-09,07/01/2023
2023-01-07,Leeds 2023: city to kick off year-long festival with 'epic' opening ceremony,Welcome To Naijamerit,,0.0,NEU,Online,,International,Leeds 2023; The Awakening,5174001151013014917,LEEDS 2023 The Awakening media coverage 7-9.01.23.csv,2023-01-09,07/01/2023
2023-01-07,Leeds 2023: city to kick off year-long festival with 'epic' opening ceremony,Yahoo UK - Yahoo News UK,,937516.0,NEU,Online,,National,Leeds 2023; The Awakening,2257117174205097016,LEEDS 2023 The Awakening media coverage 7-9.01.23.csv,2023-01-09,07/01/2023
2023-01-07,Leeds 2023: city to kick off year-long festival with 'epic' opening ceremony,www.newsdump.co.uk,,291.0,NEU,Online,,National,Leeds 2023,10871096386380491655,LEEDS 2023 The Awakening media coverage 7-9.01.23.csv,2023-01-09,07/01/2023
2023-01-07,Leeds 2023: la ciudad inaugurará un festival de un año de duración con una ceremonia inaugural 'épica',Noticias Del Mundo,,0.0,POS,Online,,International,Leeds 2023,16330426778575101249,LEEDS 2023 The Awakening media coverage 7-9.01.23.csv,2023-01-09,07/01/2023
2023-01-07,Leeds: the city so creative that it gave itself an award,"Daily Telegraph, The",317817,0.0,NEU,Newspaper,,National,Leeds 2023; The Awakening,13292286040336595026,LEEDS 2023 The Awakening media coverage 7-9.01.23.csv,2023-01-09,07/01/2023
2023-01-07,Radio clip from BBC Leeds at 2023-01-06 19:06:02.000,BBC Radio Leeds,78000,0.0,POS,Broadcast,,,Leeds 2023,15449767147319791097,LEEDS 2023 The Awakening media coverage 7-9.01.23.csv,2023-01-09,07/01/2023
2023-01-07,Radio clip from BBC Leeds at 2023-01-06 19:41:46.000,BBC Radio Leeds,78000,0.0,NEU,Broadcast,,,Leeds 2023; The Awakening,3229891755775781235,LEEDS 2023 The Awakening media coverage 7-9.01.23.csv,2023-01-09,07/01/2023
2023-01-07,Radio clip from BBC Leeds at 2023-01-06 20:17:37.000,BBC Radio Leeds,78000,0.0,POS,Broadcast,,,Leeds 2023; The Awakening,16282285551054032641,LEEDS 2023 The Awakening media coverage 7-9.01.23.csv,2023-01-09,07/01/2023
2023-01-07,Radio clip from BBC Leeds at 2023-01-06 20:26:43.000,BBC Radio Leeds,78000,0.0,NEU,Broadcast,,,Leeds 2023,5180935258194913963,LEEDS 2023 The Awakening media coverage 7-9.01.23.csv,2023-01-09,07/01/2023
2023-01-07,Radio clip from BBC Leeds at 2023-01-06 20:34:54.000,BBC Radio Leeds,78000,0.0,NEU,Broadcast,,,Leeds 2023; The Awakening,17358234406945551274,LEEDS 2023 The Awakening media coverage 7-9.01.23.csv,2023-01-09,07/01/2023
2023-01-07,Radio clip from BBC Leeds at 2023-01-06 21:21:41.000,BBC Radio Leeds,78000,0.0,NEU,Broadcast,,,Leeds 2023,16102739451218180401,LEEDS 2023 The Awakening media coverage 7-9.01.23.csv,2023-01-09,07/01/2023
2023-01-07,Radio clip from BBC Leeds at 2023-01-06 21:48:05.000,BBC Radio Leeds,78000,0.0,POS,Broadcast,,,Leeds 2023; The Awakening,749986390613077277,LEEDS 2023 The Awakening media coverage 7-9.01.23.csv,2023-01-09,07/01/2023
2023-01-07,Radio clip from BBC Leeds at 2023-01-07 06:25:42.000,BBC Radio Leeds,78000,0.0,POS,Broadcast,,,Leeds 2023,2456677111535279246,LEEDS 2023 The Awakening media coverage 7-9.01.23.csv,2023-01-09,07/01/2023
2023-01-07,Radio clip from BBC Leeds at 2023-01-07 07:00:01.000,BBC Radio Leeds,78000,0.0,NEU,Broadcast,,,Leeds 2023; The Awakening,3469723075250906906,LEEDS 2023 The Awakening media coverage 7-9.01.23.csv,2023-01-09,07/01/2023
2023-01-07,Radio clip from BBC Leeds at 2023-01-07 07:30:04.000,BBC Radio Leeds,78000,0.0,NEU,Broadcast,,,The Awakening,15013955847289109871,LEEDS 2023 The Awakening media coverage 7-9.01.23.csv,2023-01-09,07/01/2023
2023-01-07,Radio clip from BBC Leeds at 2023-01-07 07:35:07.000,BBC Radio Leeds,78000,0.0,NEU,Broadcast,,,The Awakening,8796910839131600942,LEEDS 2023 The Awakening media coverage 7-9.01.23.csv,2023-01-09,07/01/2023
2023-01-07,Radio clip from BBC Leeds at 2023-01-07 07:41:42.000,BBC Radio Leeds,78000,0.0,NEU,Broadcast,,,Leeds 2023; Leeds City of Culture; The Awakening,11479260621447085657,LEEDS 2023 The Awakening media coverage 7-9.01.23.csv,2023-01-09,07/01/2023
2023-01-07,Radio clip from BBC Leeds at 2023-01-07 07:47:54.000,BBC Radio Leeds,78000,0.0,POS,Broadcast,,,Leeds 2023,11205841378790141678,LEEDS 2023 The Awakening media coverage 7-9.01.23.csv,2023-01-09,07/01/2023
2023-01-07,Radio clip from BBC Leeds at 2023-01-07 07:52:56.000,BBC Radio Leeds,78000,0.0,POS,Broadcast,,,Leeds 2023; The Awakening,8231091765853769619,LEEDS 2023 The Awakening media coverage 7-9.01.23.csv,2023-01-09,07/01/2023
2023-01-07,Radio clip from BBC Leeds at 2023-01-07 07:57:48.000,BBC Radio Leeds,78000,0.0,NEU,Broadcast,,,The Awakening,1965689228002517024,LEEDS 2023 The Awakening media coverage 7-9.01.23.csv,2023-01-09,07/01/2023
2023-01-07,Radio clip from BBC Leeds at 2023-01-07 08:30:05.000,BBC Radio Leeds,78000,0.0,NEU,Broadcast,,,The Awakening,6570762428487638566,LEEDS 2023 The Awakening media coverage 7-9.01.23.csv,2023-01-09,07/01/2023
2023-01-07,Radio clip from BBC Leeds at 2023-01-07 09:00:01.000,BBC Radio Leeds,78000,0.0,NEU,Broadcast,,,The Awakening,3635929267632938390,LEEDS 2023 The Awakening media coverage 7-9.01.23.csv,2023-01-09,07/01/2023
2023-01-07,Radio clip from BBC Leeds at 2023-01-07 09:40:04.000,BBC Radio Leeds,78000,0.0,NEU,Broadcast,,,Leeds 2023; The Awakening,12178065168695037293,LEEDS 2023 The Awakening media coverage 7-9.01.23.csv,2023-01-09,07/01/2023
2023-01-07,Radio clip from BBC Leeds at 2023-01-07 10:00:00.000,BBC Radio Leeds,78000,0.0,NEU,Broadcast,,,Leeds 2023; The Awakening,10682325731797508066,LEEDS 2023 The Awakening media coverage 7-9.01.23.csv,2023-01-09,07/01/2023
2023-01-07,Radio clip from BBC Leeds at 2023-01-07 10:09:42.000,BBC Radio Leeds,78000,0.0,POS,Broadcast,,,The Awakening,7209393117758171549,LEEDS 2023 The Awakening media coverage 7-9.01.23.csv,2023-01-09,07/01/2023
2023-01-07,Radio clip from BBC Leeds at 2023-01-07 10:21:42.000,BBC Radio Leeds,78000,0.0,POS,Broadcast,,,Leeds 2023; The Awakening,14638094710159429618,LEEDS 2023 The Awakening media coverage 7-9.01.23.csv,2023-01-09,07/01/2023
2023-01-07,Radio clip from BBC Leeds at 2023-01-07 11:55:45.000,BBC Radio Leeds,78000,0.0,NEU,Broadcast,,,Leeds 2023; The Awakening,5459648181105113882,LEEDS 2023 The Awakening media coverage 7-9.01.23.csv,2023-01-09,07/01/2023
2023-01-07,Radio clip from BBC Leeds at 2023-01-07 15:00:02.000,BBC Radio Leeds,78000,0.0,NEU,Broadcast,,,Leeds 2023; The Awakening,7083429025684433814,LEEDS 2023 The Awakening media coverage 7-9.01.23.csv,2023-01-09,07/01/2023
2023-01-07,Radio clip from BBC Leeds at 2023-01-07 15:02:22.000,BBC Radio Leeds,78000,0.0,POS,Broadcast,,,Leeds 2023; The Awakening,12413595349252922259,LEEDS 2023 The Awakening media coverage 7-9.01.23.csv,2023-01-09,07/01/2023
2023-01-07,Radio clip from BBC Leeds at 2023-01-07 15:39:31.000,BBC Radio Leeds,78000,0.0,NEU,Broadcast,,,Leeds 2023; The Awakening,7857783323030580818,LEEDS 2023 The Awakening media coverage 7-9.01.23.csv,2023-01-09,07/01/2023
2023-01-07,Radio clip from BBC Leeds at 2023-01-07 15:45:42.000,BBC Radio Leeds,78000,0.0,NEU,Broadcast,,,Leeds 2023; The Awakening,7945522512275093271,LEEDS 2023 The Awakening media coverage 7-9.01.23.csv,2023-01-09,07/01/2023
2023-01-07,Radio clip from BBC Leeds at 2023-01-07 16:06:22.000,BBC Radio Leeds,78000,0.0,POS,Broadcast,,,Leeds 2023; The Awakening,8806231839481154575,LEEDS 2023 The Awakening media coverage 7-9.01.23.csv,2023-01-09,07/01/2023
2023-01-07,Radio clip from BBC Leeds at 2023-01-07 16:17:45.000,BBC Radio Leeds,78000,0.0,POS,Broadcast,,,Leeds 2023; The Awakening,15725128302901567482,LEEDS 2023 The Awakening media coverage 7-9.01.23.csv,2023-01-09,07/01/2023
2023-01-07,Radio clip from BBC Leeds at 2023-01-07 16:22:47.000,BBC Radio Leeds,78000,0.0,POS,Broadcast,,,Leeds 2023; Leeds City of Culture; The Awakening,7251499712851089452,LEEDS 2023 The Awakening media coverage 7-9.01.23.csv,2023-01-09,07/01/2023
2023-01-07,Radio clip from BBC Leeds at 2023-01-07 16:50:41.000,BBC Radio Leeds,78000,0.0,NEU,Broadcast,,,Leeds 2023; The Awakening,3228473601671315707,LEEDS 2023 The Awakening media coverage 7-9.01.23.csv,2023-01-09,07/01/2023
2023-01-07,Radio clip from BBC Leeds at 2023-01-07 17:20:29.000,BBC Radio Leeds,78000,0.0,NEU,Broadcast,,,Leeds 2023; The Awakening,16087929857629110177,LEEDS 2023 The Awakening media coverage 7-9.01.23.csv,2023-01-09,07/01/2023
2023-01-07,Radio clip from BBC Leeds at 2023-01-07 17:25:42.000,BBC Radio Leeds,78000,0.0,NEU,Broadcast,,,Leeds 2023; The Awakening,5569753980262372035,LEEDS 2023 The Awakening media coverage 7-9.01.23.csv,2023-01-09,07/01/2023
2023-01-07,Radio clip from BBC Leeds at 2023-01-07 18:21:42.000,BBC Radio Leeds,78000,0.0,POS,Broadcast,,,Leeds 2023,11261578220385210752,LEEDS 2023 The Awakening media coverage 7-9.01.23.csv,2023-01-09,07/01/2023
2023-01-07,Radio clip from Capital FM Yorkshire at 2023-01-07 05:59:15.000,Capital FM Yorkshire,,0.0,NEU,Broadcast,,,Leeds 2023,6267527317023563688,LEEDS 2023 The Awakening media coverage 7-9.01.23.csv,2023-01-09,07/01/2023
2023-01-07,Radio clip from Greatest Hits Leeds at 2023-01-07 07:00:01.000,Greatest Hits Leeds,,0.0,NEU,Broadcast,,,Leeds 2023; The Awakening,9581132774053942612,LEEDS 2023 The Awakening media coverage 7-9.01.23.csv,2023-01-09,07/01/2023
2023-01-07,Radio clip from Greatest Hits Leeds at 2023-01-07 08:00:01.000,Greatest Hits Leeds,,0.0,NEU,Broadcast,,,Leeds 2023; The Awakening,17559597408267638587,LEEDS 2023 The Awakening media coverage 7-9.01.23.csv,2023-01-09,07/01/2023
2023-01-07,Radio clip from Greatest Hits Leeds at 2023-01-07 09:00:02.000,Greatest Hits Leeds,,0.0,NEU,Broadcast,,,Leeds 2023; The Awakening,12502924871075380970,LEEDS 2023 The Awakening media coverage 7-9.01.23.csv,2023-01-09,07/01/2023
2023-01-07,Radio clip from Greatest Hits Leeds at 2023-01-07 10:00:00.000,Greatest Hits Leeds,,0.0,NEU,Broadcast,,,Leeds 2023; The Awakening,10725866070419353126,LEEDS 2023 The Awakening media coverage 7-9.01.23.csv,2023-01-09,07/01/2023
2023-01-07,Radio clip from Greatest Hits Leeds at 2023-01-07 11:00:01.000,Greatest Hits Leeds,,0.0,NEU,Broadcast,,,Leeds 2023; The Awakening,16708192912590503621,LEEDS 2023 The Awakening media coverage 7-9.01.23.csv,2023-01-09,07/01/2023
2023-01-07,Radio clip from Greatest Hits Leeds at 2023-01-07 12:00:01.000,Greatest Hits Leeds,,0.0,NEU,Broadcast,,,Leeds 2023; The Awakening,10671100161062492611,LEEDS 2023 The Awakening media coverage 7-9.01.23.csv,2023-01-09,07/01/2023
2023-01-07,Radio clip from Greatest Hits Leeds at 2023-01-07 13:00:00.000,Greatest Hits Leeds,,0.0,NEU,Broadcast,,,Leeds 2023; The Awakening,10318120702892643952,LEEDS 2023 The Awakening media coverage 7-9.01.23.csv,2023-01-09,07/01/2023
